,nr,q_nr,theory_nr,theory,question,answer,meta_folder,meta_file,meta_depth,meta_id,D_maxD,D_NFact,D_NRule,Q_Dep,Q_Len,Q_strategy,Q_proofs
342336,42313,0,2940,The cow is green. The cow is not kind. The cow does not visit the lion. The dog chases the lion. The lion eats the cow. The lion is red. The lion visits the dog. If someone chases the lion and they visit the lion then they eat the cow. If someone is kind then they eat the dog. If someone visits the dog and they are red then they chase the cow. If someone chases the lion and they are not kind then they are blue. If the dog chases the cow then the dog visits the cow. If someone visits the dog then they visit the cow. If someone chases the cow then the cow visits the dog. If someone eats the dog and the dog does not chase the cow then they are big.,The lion is red.,True,OWA,train,3,RelNeg-OWA-D3-690,3,7,8,0,1,proof,[(triple6)]
316630,16607,0,1157,The bear sees the dog. The dog eats the mouse. The mouse is blue. The mouse is kind. The mouse sees the dog. The tiger needs the dog. The tiger sees the dog. If something is blue then it needs the bear. If something sees the bear and the bear sees the tiger then it is kind. If the tiger needs the dog and the tiger is nice then the tiger eats the bear. If something is red then it eats the dog. If something eats the mouse then it needs the mouse. If something is blue and it needs the bear then it is red. If the tiger is kind then the tiger sees the dog. If something is kind and nice then it sees the mouse.,The mouse sees the dog.,True,OWA,train,3,RelNoneg-OWA-D3-736,3,7,8,0,1,proof,[(triple5)]
25050,25051,0,6782,"The cow chases the lion. The cow is round. The lion needs the tiger. The squirrel chases the tiger. The squirrel needs the cow. The squirrel needs the tiger. The tiger is green. Blue, green people are round. If the lion likes the tiger then the tiger likes the squirrel. If someone is green and they chase the lion then they like the tiger. If someone is kind and green then they like the tiger. If someone needs the cow and the cow chases the lion then the cow needs the squirrel. If someone needs the cow then the cow likes the lion. If someone is kind then they chase the tiger. If someone likes the squirrel then the squirrel chases the tiger.",The squirrel needs the tiger.,True,OWA,train,0,RelNoneg-OWA-D0-5350,1,7,8,0,1,proof,[(triple6)]
16902,16903,0,4582,The cat chases the squirrel. The cat likes the squirrel. The dog chases the cat. The dog chases the mouse. The mouse is cold. The mouse sees the dog. The squirrel is green. If someone sees the squirrel then they are kind. If someone chases the cat and the cat sees the dog then the cat does not like the dog. If someone chases the squirrel then the squirrel likes the cat. If the cat likes the dog then the cat is not kind. If someone is green then they see the cat. If someone likes the cat then the cat likes the mouse. If someone chases the squirrel and they see the dog then the dog chases the squirrel. If someone sees the cat and they like the mouse then they see the dog.,The cat likes the squirrel.,True,OWA,train,0,RelNeg-OWA-D0-5133,2,7,8,0,1,proof,[(triple2)]
66036,66037,0,17852,"Charlie is kind. Charlie is quiet. Charlie is red. Charlie is rough. Charlie is round. Charlie is smart. Charlie is young. If Charlie is kind then Charlie is rough. If Charlie is not rough then Charlie is round. All round, kind people are smart. Kind people are smart. All quiet people are smart. If someone is rough and not kind then they are smart. All quiet, round people are red. Round, kind people are red.",Charlie is smart.,True,OWA,train,0,AttNeg-OWA-D0-2229,0,7,8,0,1,proof,[(triple6 OR ((triple1) -> rule4) OR ((triple2) -> rule5) OR ((triple5 triple1) -> rule3))]
53166,53167,0,14365,Harry is not blue. Harry is cold. Harry is furry. Harry is not green. Harry is not kind. Harry is red. Harry is not round. If someone is cold and round then they are green. Blue people are green. If Harry is blue then Harry is not round. All kind people are red. If someone is kind then they are red. If Harry is cold then Harry is red. If someone is green and blue then they are not kind. If someone is green and not kind then they are furry.,Harry is cold.,True,OWA,train,0,AttNeg-OWA-D0-2600,0,7,8,0,1,proof,[(triple2)]
958,959,0,259,"Charlie is big. Charlie is blue. Charlie is furry. Charlie is nice. Charlie is quiet. Charlie is round. Charlie is young. If someone is young and round then they are blue. Nice, quiet people are big. If Charlie is big then Charlie is nice. Nice people are furry. If someone is nice and quiet then they are blue. Quiet, round people are furry. If Charlie is nice then Charlie is round. If someone is round and blue then they are young.",Charlie is furry.,True,OWA,train,0,AttNoneg-OWA-D0-883,0,7,8,0,1,proof,[(triple3 OR ((triple4) -> rule4) OR ((triple5 triple6) -> rule6) OR ((((triple1) -> rule3)) -> rule4) OR ((triple5 ((triple4) -> rule7)) -> rule6) OR ((triple5 ((((triple1) -> rule3)) -> rule7)) -> rule6))]
379282,9871,0,681,"Anne is furry. Anne is rough. Anne is smart. Erin is furry. Erin is kind. Erin is quiet. Erin is not white. If Anne is round and Anne is smart then Anne is kind. Rough, smart things are round. If Anne is quiet then Anne is round. Rough, kind things are smart. All kind things are quiet. If Erin is round then Erin is quiet. Round, smart things are kind. If Erin is smart and Erin is not furry then Erin is rough.",Anne is rough.,True,OWA,test,3,AttNeg-OWA-D3-1191,3,7,8,0,1,proof,[(triple2)]
389084,19673,0,1358,Bob is blue. Bob is cold. Bob is furry. Bob is kind. Bob is red. Bob is rough. Fiona is kind. If Fiona is cold then Fiona is furry. If Fiona is rough and Fiona is red then Fiona is kind. All cold people are red. If someone is rough and kind then they are furry. Kind people are rough. If Fiona is kind and Fiona is rough then Fiona is furry. If someone is furry then they are cold. All cold people are kind.,Bob is red.,True,OWA,test,3,AttNoneg-OWA-D3-1493,4,7,8,0,1,proof,[(triple5 OR ((triple2) -> rule3) OR ((((triple3) -> rule7)) -> rule3) OR ((((((triple6 triple4) -> rule4)) -> rule7)) -> rule3) OR ((((((((triple4) -> rule5) triple4) -> rule4)) -> rule7)) -> rule3))]
76302,6397,0,1727,The bald eagle chases the lion. The bald eagle eats the tiger. The bald eagle is not red. The bald eagle is rough. The lion needs the bald eagle. The tiger does not eat the bald eagle. The tiger needs the bald eagle. If someone is blue then they are not red. If someone eats the lion then they do not need the tiger. If the tiger is young then the tiger does not chase the bald eagle. If someone is young and they need the tiger then they are not big. If someone needs the lion then they are not young. If the lion eats the bald eagle and the bald eagle chases the lion then the lion is big. If the tiger is big and the tiger does not eat the lion then the lion chases the tiger. If the bald eagle is red then the bald eagle is big.,The bald eagle eats the tiger.,True,OWA,test,0,RelNeg-OWA-D0-5165,0,7,8,0,1,proof,[(triple2)]
1050,1051,0,284,"Harry is not furry. Harry is kind. Harry is red. Harry is rough. Harry is not round. Harry is smart. Harry is white. All kind, furry people are white. If someone is rough and not round then they are not furry. Kind people are smart. If someone is white then they are smart. If someone is red then they are rough. If someone is round then they are not rough. If Harry is furry then Harry is kind. All furry, rough people are red.",Harry is smart.,True,OWA,train,0,AttNeg-OWA-D0-4408,0,7,8,0,1,proof,[(triple6 OR ((triple2) -> rule3) OR ((triple7) -> rule4))]
316902,16879,0,1175,"Anne is blue. Anne is nice. Bob is blue. Bob is round. Dave is kind. Dave is not nice. Erin is nice. If someone is white then they are kind. If Anne is not round then Anne is not kind. If someone is round and not blue then they are not white. All nice, round people are rough. All blue people are nice. If someone is kind and smart then they are nice. If someone is nice and not white then they are not smart. If someone is rough then they are not smart.",Dave is kind.,True,OWA,train,3,AttNeg-OWA-D3-1698,3,7,8,0,1,proof,[(triple5)]
439972,39913,0,1901,"Anne is not blue. Anne is cold. Charlie is cold. Fiona is cold. Fiona is rough. Harry is blue. Harry is not nice. Big, cold things are not white. If something is cold and not blue then it is big. If something is red and not white then it is rough. Red things are rough. If something is big and not white then it is nice. All white things are not nice. If something is white and not blue then it is nice. Nice things are red.",Harry is blue.,True,OWA,train,5,AttNeg-OWA-D5-151,5,7,8,0,1,proof,[(triple6)]
84186,14281,0,3840,"Bob is not big. Bob is blue. Bob is not green. Bob is not round. Bob is smart. Bob is not white. Erin is blue. All blue, young things are not white. If something is blue and round then it is white. If something is round and not smart then it is young. All white, young things are big. If Erin is blue and Erin is young then Erin is green. If Erin is big then Erin is white. All young things are round. Green things are round.",Bob is not green.,True,OWA,test,0,AttNeg-OWA-D0-3812,0,7,8,0,1,proof,[(triple3)]
91664,1735,0,470,"Gary is big. Gary is cold. Gary is furry. Gary is kind. Gary is not quiet. Gary is round. Gary is young. Big, kind people are cold. If someone is big and not kind then they are cold. If someone is young and not kind then they are cold. All quiet people are cold. Kind people are cold. If someone is furry and not big then they are not cold. If someone is cold and not quiet then they are young. All round, kind people are furry.",Gary is young.,True,OWA,dev,0,AttNeg-OWA-D0-2684,0,7,8,0,1,proof,[(triple7 OR ((triple2 triple5) -> rule7) OR ((((triple4) -> rule5) triple5) -> rule7) OR ((((triple1 triple4) -> rule1) triple5) -> rule7))]
22598,22599,0,6121,Fiona is blue. Fiona is furry. Fiona is quiet. Fiona is red. Fiona is rough. Fiona is white. Fiona is not young. All young things are blue. All red things are not young. If Fiona is blue then Fiona is not young. If something is furry and quiet then it is red. If something is quiet and young then it is furry. If something is young and rough then it is quiet. If Fiona is furry then Fiona is white. If Fiona is red and Fiona is not furry then Fiona is white.,Fiona is red.,True,OWA,train,0,AttNeg-OWA-D0-4106,0,7,8,0,1,proof,[(triple4 OR ((triple2 triple3) -> rule4))]
53204,53205,0,14376,"Bob is blue. Bob is kind. Bob is red. Bob is round. Bob is young. Dave is cold. Dave is young. Kind people are cold. If someone is kind then they are cold. If Bob is big and Bob is not red then Bob is not blue. All cold people are kind. All blue, kind people are round. All red people are round. If someone is cold and not kind then they are not blue. Cold, red people are blue.",Bob is round.,True,OWA,train,0,AttNeg-OWA-D0-2660,1,7,8,0,1,proof,[(triple4 OR ((triple3) -> rule6) OR ((triple1 triple2) -> rule5) OR ((((((triple2) -> rule1) triple3) -> rule8) triple2) -> rule5) OR ((((((triple2) -> rule2) triple3) -> rule8) triple2) -> rule5))]
121124,21125,0,2730,"Anne is cold. Erin is rough. Fiona is big. Fiona is blue. Fiona is cold. Fiona is quiet. Fiona is rough. If something is quiet and furry then it is cold. All rough things are not furry. All furry, rough things are blue. Quiet things are blue. If something is quiet and not cold then it is green. If something is furry then it is big. If something is quiet and not cold then it is not big. If something is rough and not furry then it is big.",Fiona is quiet.,True,OWA,train,1,AttNeg-OWA-D1-1422,2,7,8,0,1,proof,[(triple6)]
41930,41931,0,11345,Charlie is cold. Charlie is furry. Charlie is kind. Charlie is red. Charlie is smart. Charlie is white. Charlie is young. If something is smart and furry then it is red. If Charlie is kind and Charlie is smart then Charlie is red. If something is red and kind then it is white. If something is kind then it is white. All kind things are furry. If Charlie is white then Charlie is cold. All kind things are young. All cold things are young.,Charlie is kind.,True,OWA,train,0,AttNoneg-OWA-D0-3952,0,7,8,0,1,proof,[(triple3)]
19890,19891,0,5380,"Gary is big. Gary is blue. Gary is cold. Gary is not quiet. Gary is red. Gary is smart. Gary is not young. Big people are red. All big people are red. If someone is red and not cold then they are smart. If Gary is red then Gary is blue. Quiet, red people are not big. All smart people are big. All smart, quiet people are blue. If someone is red and not cold then they are not blue.",Gary is blue.,True,OWA,train,0,AttNeg-OWA-D0-4665,0,7,8,0,1,proof,[(triple2 OR ((triple5) -> rule4) OR ((((triple1) -> rule1)) -> rule4) OR ((((triple1) -> rule2)) -> rule4) OR ((((((triple6) -> rule6)) -> rule1)) -> rule4) OR ((((((triple6) -> rule6)) -> rule2)) -> rule4))]
66368,66369,0,17940,"Bob is blue. Bob is furry. Bob is nice. Bob is quiet. Dave is cold. Dave is furry. Dave is nice. If Bob is nice then Bob is blue. If something is furry and cold then it is nice. If something is cold then it is furry. Quiet things are nice. If Bob is quiet then Bob is nice. If something is quiet and nice then it is cold. If something is blue and quiet then it is big. Cold, nice things are furry.",Dave is cold.,True,OWA,train,0,AttNoneg-OWA-D0-535,1,7,8,0,1,proof,[(triple5)]
428724,28665,0,1368,"Charlie is red. Erin is cold. Erin is kind. Gary is furry. Gary is red. Harry is not blue. Harry is kind. All cold people are big. All kind, furry people are cold. Furry people are cold. If someone is big then they are blue. All furry, big people are red. If someone is kind and quiet then they are furry. If someone is blue and cold then they are quiet. If Gary is blue then Gary is furry.",Gary is red.,True,OWA,train,5,AttNeg-OWA-D5-706,5,7,8,0,1,proof,[(triple5 OR ((triple4 ((((triple4) -> rule3)) -> rule1)) -> rule5))]
244594,44581,0,4019,"Anne is furry. Anne is kind. Charlie is blue. Charlie is cold. Charlie is furry. Charlie is kind. Dave is kind. If Anne is blue then Anne is big. If Dave is smart and Dave is round then Dave is blue. If someone is big and smart then they are kind. All furry people are blue. If someone is kind then they are smart. If someone is big and blue then they are smart. All round, kind people are furry. If someone is furry then they are blue.",Charlie is blue.,True,OWA,train,2,AttNoneg-OWA-D2-296,2,7,8,0,1,proof,[(triple3 OR ((triple5) -> rule4) OR ((triple5) -> rule8))]
368382,68359,0,4745,The rabbit is big. The rabbit is blue. The rabbit is cold. The rabbit is red. The rabbit likes the tiger. The rabbit visits the tiger. The tiger likes the rabbit. If someone is red then they like the tiger. If someone is red then they are not young. If someone is red and they see the tiger then they visit the tiger. If someone is blue and not young then they see the tiger. If the tiger visits the rabbit and the rabbit visits the tiger then the tiger likes the rabbit. If someone likes the rabbit then the rabbit visits the tiger. If someone likes the rabbit then the rabbit visits the tiger. If someone is big and they see the tiger then the tiger sees the rabbit.,The rabbit likes the tiger.,True,OWA,train,3,RelNeg-OWA-D3-599,3,7,8,0,1,proof,[(triple5 OR ((triple4) -> rule1))]
413670,13611,0,652,"Anne is quiet. Anne is red. Anne is smart. Bob is smart. Erin is young. Fiona is quiet. Fiona is round. All white people are red. If someone is young then they are furry. If someone is furry and quiet then they are white. All quiet people are young. If Fiona is quiet then Fiona is white. If someone is smart then they are quiet. Red, smart people are round. All furry, red people are white.",Fiona is round.,True,OWA,train,5,AttNoneg-OWA-D5-360,6,7,8,0,1,proof,[(triple7)]
280966,10877,0,985,The lion is nice. The lion is red. The squirrel chases the tiger. The squirrel likes the lion. The tiger chases the squirrel. The tiger likes the lion. The tiger sees the lion. If someone likes the lion then they see the lion. If the squirrel chases the lion and the squirrel sees the tiger then the squirrel chases the tiger. If someone sees the tiger then they see the squirrel. If someone chases the squirrel and they chase the lion then the squirrel is nice. If someone sees the squirrel and they are blue then they chase the tiger. If someone is young and nice then they chase the lion. If someone likes the tiger and the tiger is nice then they like the squirrel. If someone is nice then they see the tiger.,The squirrel chases the tiger.,True,OWA,test,2,RelNoneg-OWA-D2-1335,2,7,8,0,1,proof,[(triple3)]
239816,39803,0,3590,"Fiona is blue. Fiona is white. Harry is big. Harry is kind. Harry is quiet. Harry is round. Harry is white. If Harry is smart and Harry is not big then Harry is kind. Big people are smart. All kind people are smart. All round people are smart. If someone is smart then they are white. All smart, big people are white. White people are round. If someone is round and not quiet then they are blue.",Harry is kind.,True,OWA,train,2,AttNeg-OWA-D2-576,2,7,8,0,1,proof,[(triple4)]
50580,50581,0,13671,"Erin is green. Erin is not red. Erin is white. Erin is young. Fiona is furry. Fiona is green. Fiona is young. If Fiona is nice and Fiona is white then Fiona is green. Red people are green. If someone is white then they are not red. Young, green people are not red. Nice, red people are furry. Red people are not nice. Furry people are not cold. If someone is young and not nice then they are cold.",Fiona is furry.,True,OWA,train,0,AttNeg-OWA-D0-1380,1,7,8,0,1,proof,[(triple5)]
259114,59101,0,5335,"Dave is not blue. Dave is not furry. Dave is nice. Dave is rough. Harry is big. Harry is furry. Harry is quiet. All big, blue things are nice. If something is nice and quiet then it is big. If Harry is rough and Harry is blue then Harry is quiet. Rough, big things are quiet. All rough, blue things are not quiet. If Dave is smart then Dave is nice. If Dave is not furry then Dave is big. If Dave is furry then Dave is smart.",Dave is nice.,True,OWA,train,2,AttNeg-OWA-D2-1972,2,7,8,0,1,proof,[(triple3)]
50898,50899,0,13758,The cow is round. The dog is green. The dog likes the mouse. The dog sees the cow. The dog sees the mouse. The mouse chases the cow. The mouse does not see the dog. If the cow likes the dog then the dog is big. Big people are kind. If someone is cold and they like the dog then the dog sees the mouse. If the mouse is not round then the mouse sees the dog. If someone is big then they do not like the mouse. If someone is cold and big then they see the mouse. If someone sees the dog and they are kind then they are cold. If someone is round and they see the dog then they do not chase the mouse.,The dog likes the mouse.,True,OWA,train,0,RelNeg-OWA-D0-1774,0,7,8,0,1,proof,[(triple3)]
366160,66137,0,4594,The lion is nice. The rabbit does not chase the lion. The rabbit chases the tiger. The rabbit does not eat the lion. The rabbit is young. The rabbit needs the tiger. The tiger is not nice. If the rabbit does not chase the lion then the lion is not kind. If something chases the lion then it is big. If something is young and it needs the tiger then the tiger needs the lion. If the tiger needs the lion then the tiger chases the lion. If something is nice then it chases the tiger. If something eats the lion and it does not chase the rabbit then the lion does not eat the tiger. If the lion is not kind then the lion eats the rabbit. If something eats the lion and it does not eat the tiger then it is rough.,The rabbit needs the tiger.,True,OWA,train,3,RelNeg-OWA-D3-1243,3,7,8,0,1,proof,[(triple6)]
220446,20433,0,1838,The lion is green. The squirrel chases the lion. The squirrel eats the lion. The squirrel is green. The squirrel is rough. The squirrel is round. The squirrel sees the lion. If something sees the squirrel then it does not chase the lion. If the lion is nice and the lion sees the squirrel then the squirrel is nice. If something is green then it is nice. If the lion is nice then the lion is not rough. If the squirrel is nice then the squirrel is rough. If something is rough and it eats the squirrel then it does not eat the lion. If the lion chases the squirrel and the squirrel does not chase the lion then the lion does not eat the squirrel. If something sees the lion then the lion does not eat the squirrel.,The squirrel is round.,True,OWA,train,2,RelNeg-OWA-D2-1833,2,7,8,0,1,proof,[(triple6)]
462744,62685,0,2982,The mouse likes the squirrel. The mouse needs the rabbit. The rabbit does not like the tiger. The rabbit needs the tiger. The squirrel is young. The tiger is cold. The tiger visits the squirrel. If the squirrel visits the rabbit and the squirrel visits the tiger then the squirrel likes the rabbit. If someone likes the mouse and the mouse is cold then the mouse visits the rabbit. If someone is young then they are green. If someone visits the mouse and they like the squirrel then the mouse is young. If someone needs the mouse then the mouse is young. If someone is green then they need the mouse. If someone needs the rabbit then the rabbit needs the tiger. If the tiger visits the mouse then the tiger is kind.,The rabbit does not like the tiger.,True,OWA,train,5,RelNeg-OWA-D5-653,5,7,8,0,1,proof,[(triple3)]
151304,51305,0,6635,The bear chases the dog. The bear needs the rabbit. The cat needs the rabbit. The dog is big. The dog is blue. The dog is round. The rabbit needs the bear. If something likes the bear then the bear chases the rabbit. If the cat is green and the cat is big then the cat needs the bear. If something needs the bear then it does not like the cat. If something chases the dog then it does not chase the cat. If something is rough then it does not like the rabbit. If something is green then it does not like the rabbit. If the dog is not big then the dog is green. If something is green and it does not chase the rabbit then it does not need the cat.,The cat needs the rabbit.,True,OWA,train,1,RelNeg-OWA-D1-2141,1,7,8,0,1,proof,[(triple3)]
7030,7031,0,1910,"Bob is big. Bob is cold. Bob is furry. Bob is quiet. Bob is rough. Bob is smart. Bob is young. If Bob is quiet then Bob is cold. Rough, cold people are big. If Bob is cold and Bob is furry then Bob is rough. Furry, smart people are cold. Smart, young people are cold. If Bob is furry then Bob is cold. If someone is big then they are cold. If Bob is big then Bob is cold.",Bob is rough.,True,OWA,train,0,AttNoneg-OWA-D0-4706,0,7,8,0,1,proof,[(triple5 OR ((triple2 triple3) -> rule3) OR ((((triple1) -> rule7) triple3) -> rule3) OR ((((triple1) -> rule8) triple3) -> rule3) OR ((((triple3) -> rule6) triple3) -> rule3) OR ((((triple4) -> rule1) triple3) -> rule3) OR ((((triple3 triple6) -> rule4) triple3) -> rule3) OR ((((triple6 triple7) -> rule5) triple3) -> rule3))]
345614,45591,0,3166,The bear is rough. The bear is young. The bear likes the mouse. The cat likes the tiger. The mouse chases the bear. The tiger eats the bear. The tiger likes the cat. If something is rough then it likes the tiger. If something is kind then it is round. If the bear likes the tiger then the tiger is rough. If something eats the bear then the bear eats the mouse. If something likes the cat then the cat chases the mouse. If the tiger is rough then the tiger likes the bear. If something is kind then it is rough. If something likes the tiger and the tiger chases the mouse then the mouse chases the tiger.,The tiger likes the cat.,True,OWA,train,3,RelNoneg-OWA-D3-1336,3,7,8,0,1,proof,[(triple7)]
362990,62967,0,4372,"Anne is not furry. Anne is white. Charlie is furry. Charlie is smart. Erin is nice. Erin is red. Fiona is smart. If something is white and smart then it is not nice. All rough things are red. All kind, red things are white. All smart things are white. If something is nice then it is rough. If something is smart then it is rough. If something is red then it is furry. If Charlie is kind and Charlie is furry then Charlie is smart.",Erin is red.,True,OWA,train,3,AttNeg-OWA-D3-623,3,7,8,0,1,proof,[(triple6 OR ((((triple5) -> rule5)) -> rule2))]
79640,9735,0,2625,"Anne is rough. Anne is young. Dave is young. Fiona is green. Fiona is kind. Fiona is young. Harry is white. White, green things are young. If Dave is big then Dave is kind. If Anne is green and Anne is white then Anne is blue. White, blue things are green. All white, rough things are kind. All young, green things are blue. All young things are white. Rough, green things are young.",Anne is rough.,True,OWA,test,0,AttNoneg-OWA-D0-3635,2,7,8,0,1,proof,[(triple1)]
28802,28803,0,7799,"Erin is big. Erin is cold. Erin is furry. Erin is green. Erin is nice. Erin is white. Erin is young. If something is big then it is cold. If something is white and green then it is big. All nice, cold things are big. If something is white then it is furry. All big, furry things are cold. All cold things are furry. If Erin is young then Erin is white. If something is white then it is green.",Erin is furry.,True,OWA,train,0,AttNoneg-OWA-D0-1606,0,7,8,0,1,proof,[(triple3 OR ((triple2) -> rule6) OR ((triple6) -> rule4) OR ((((triple1) -> rule1)) -> rule6) OR ((((triple7) -> rule7)) -> rule4) OR ((((((triple6 triple4) -> rule2)) -> rule1)) -> rule6) OR ((((((triple6 ((triple6) -> rule8)) -> rule2)) -> rule1)) -> rule6) OR ((((((((triple7) -> rule7) triple4) -> rule2)) -> rule1)) -> rule6) OR ((((((((triple7) -> rule7) ((triple6) -> rule8)) -> rule2)) -> rule1)) -> rule6) OR ((((((triple6 ((((triple7) -> rule7)) -> rule8)) -> rule2)) -> rule1)) -> rule6) OR ((((((((triple7) -> rule7) ((((triple7) -> rule7)) -> rule8)) -> rule2)) -> rule1)) -> rule6))]
