,nr,q_nr,theory_nr,theory,question,answer,meta_folder,meta_file,meta_depth,meta_id,D_maxD,D_NFact,D_NRule,Q_Dep,Q_Len,Q_strategy,Q_proofs
28412,28413,0,7689,"Harry is big. Harry is green. Harry is nice. Harry is rough. Harry is round. Harry is white. Harry is young. If something is green then it is big. If something is white then it is round. If something is young then it is rough. If something is young then it is nice. All round things are young. All nice things are big. Round, white things are young. If Harry is round then Harry is young.",Harry is big.,True,OWA,train,0,AttNoneg-OWA-D0-4146,0,7,8,0,1,proof,[(triple1 OR ((triple2) -> rule1) OR ((triple3) -> rule6) OR ((((triple7) -> rule4)) -> rule6) OR ((((((triple5) -> rule5)) -> rule4)) -> rule6) OR ((((((triple5) -> rule8)) -> rule4)) -> rule6) OR ((((((triple5 triple6) -> rule7)) -> rule4)) -> rule6) OR ((((((((triple6) -> rule2)) -> rule5)) -> rule4)) -> rule6) OR ((((((((triple6) -> rule2)) -> rule8)) -> rule4)) -> rule6) OR ((((((((triple6) -> rule2) triple6) -> rule7)) -> rule4)) -> rule6))]
211814,11801,0,1063,"Bob is blue. Bob is furry. Bob is rough. Bob is smart. Gary is smart. Gary is white. Gary is young. If someone is smart then they are young. Blue, smart people are young. If Bob is rough then Bob is furry. If Bob is blue then Bob is furry. All blue people are young. Rough people are blue. All smart people are rough. All smart, blue people are young.",Gary is smart.,True,OWA,train,2,AttNoneg-OWA-D2-367,2,7,8,0,1,proof,[(triple5)]
161368,61369,0,7938,"Anne is blue. Anne is kind. Anne is nice. Erin is nice. Erin is quiet. Erin is not rough. Harry is quiet. All kind, furry things are quiet. If Harry is not young then Harry is rough. Nice things are furry. Rough things are blue. Nice things are blue. All rough things are blue. Young, furry things are kind. If Harry is kind and Harry is not furry then Harry is blue.",Anne is kind.,True,OWA,train,1,AttNeg-OWA-D1-1195,2,7,8,0,1,proof,[(triple2)]
35072,35073,0,9491,"Anne is big. Anne is blue. Anne is cold. Anne is furry. Anne is round. Anne is smart. Anne is young. Blue, round things are smart. All round things are smart. If something is young then it is cold. If Anne is not furry then Anne is young. If Anne is not big then Anne is young. All big things are young. All blue things are round. All smart, round things are blue.",Anne is smart.,True,OWA,train,0,AttNeg-OWA-D0-2435,0,7,8,0,1,proof,[(triple6 OR ((triple5) -> rule2) OR ((triple2 triple5) -> rule1) OR ((((triple2) -> rule7)) -> rule2) OR ((triple2 ((triple2) -> rule7)) -> rule1))]
54644,54645,0,14773,"Anne is green. Anne is kind. Dave is cold. Dave is green. Dave is smart. Harry is kind. Harry is young. If Anne is smart then Anne is green. All green, round things are kind. If something is nice then it is green. If something is nice and round then it is kind. All nice things are kind. All smart things are young. If something is young and cold then it is nice. Kind, nice things are cold.",Harry is young.,True,OWA,train,0,AttNoneg-OWA-D0-6147,3,7,8,0,1,proof,[(triple7)]
289010,18921,0,1712,The bear needs the tiger. The dog sees the bear. The rabbit likes the dog. The rabbit likes the tiger. The rabbit does not see the bear. The tiger is young. The tiger needs the bear. If something likes the tiger then it needs the dog. If something sees the dog and the dog likes the rabbit then it likes the rabbit. If something likes the dog and it does not see the rabbit then the dog is not young. If something needs the dog then it is blue. If something needs the tiger then the tiger needs the rabbit. If something likes the bear then the bear needs the rabbit. If the dog does not see the tiger then the tiger likes the bear. If something needs the dog and the dog likes the bear then it sees the dog.,The rabbit likes the tiger.,True,OWA,test,2,RelNeg-OWA-D2-939,2,7,8,0,1,proof,[(triple4)]
82022,12117,0,3257,"Anne is cold. Anne is kind. Anne is round. Dave is rough. Harry is kind. Harry is quiet. Harry is red. All quiet people are white. All round, white people are cold. If someone is quiet then they are red. All kind people are cold. If Dave is quiet then Dave is cold. If Dave is red then Dave is kind. Cold people are red. If someone is kind then they are red.",Dave is rough.,True,OWA,test,0,AttNoneg-OWA-D0-5278,1,7,8,0,1,proof,[(triple4)]
104752,4753,0,614,The cat chases the lion. The cat sees the lion. The cat visits the lion. The cow is round. The cow sees the cat. The cow visits the cat. The lion is young. If something sees the cat and the cat is green then the cat is cold. If something is young then it visits the cat. If the cat chases the cow and the cow visits the lion then the cat is cold. If something visits the cat and it chases the cow then the cat chases the lion. If something sees the cow then the cow sees the lion. If something visits the lion and the lion is round then the lion visits the cow. If something sees the cow and the cow sees the cat then it chases the cow. If the lion visits the cow then the cow visits the cat.,The cat visits the lion.,True,OWA,train,1,RelNoneg-OWA-D1-836,1,7,8,0,1,proof,[(triple3)]
460562,60503,0,2879,"Bob is big. Bob is furry. Charlie is furry. Charlie is nice. Dave is furry. Dave is nice. Erin is white. If Dave is white then Dave is not kind. All white things are blue. If Erin is blue then Erin is big. If something is white and cold then it is not furry. All blue, big things are nice. If Erin is furry and Erin is white then Erin is kind. If something is cold then it is not kind. White, nice things are cold.",Erin is white.,True,OWA,train,5,AttNeg-OWA-D5-827,5,7,8,0,1,proof,[(triple7)]
60170,60171,0,16266,"Erin is big. Erin is green. Erin is kind. Erin is nice. Erin is not rough. Erin is round. Erin is young. If something is green and not nice then it is not round. Rough things are round. If something is nice and not big then it is kind. Young, round things are kind. Kind, young things are green. Young things are not rough. If something is round then it is young. If Erin is rough and Erin is big then Erin is not green.",Erin is green.,True,OWA,train,0,AttNeg-OWA-D0-4046,0,7,8,0,1,proof,[(triple2 OR ((triple3 triple7) -> rule5) OR ((triple3 ((triple6) -> rule7)) -> rule5) OR ((((triple7 triple6) -> rule4) triple7) -> rule5) OR ((((triple7 triple6) -> rule4) ((triple6) -> rule7)) -> rule5) OR ((((((triple6) -> rule7) triple6) -> rule4) triple7) -> rule5) OR ((((((triple6) -> rule7) triple6) -> rule4) ((triple6) -> rule7)) -> rule5))]
67938,67939,0,18365,The lion chases the tiger. The lion is round. The lion likes the mouse. The mouse chases the tiger. The squirrel chases the tiger. The squirrel likes the mouse. The tiger chases the squirrel. If someone chases the mouse and the mouse is rough then the mouse sees the squirrel. If someone chases the squirrel then they like the squirrel. If the mouse sees the tiger and the mouse does not like the lion then the tiger sees the squirrel. If someone is blue then they see the mouse. If the lion is rough then the lion does not like the squirrel. If someone likes the squirrel then they see the squirrel. All blue people are round. If the tiger likes the lion then the lion does not like the mouse.,The mouse chases the tiger.,True,OWA,train,0,RelNeg-OWA-D0-4955,2,7,8,0,1,proof,[(triple4)]
465543,65484,1,3119,"Bob is big. Bob is smart. Dave is blue. Dave is white. Gary is rough. Harry is blue. Harry is nice. If Harry is rough then Harry is young. All young people are big. If someone is blue and rough then they are smart. All blue people are smart. White people are blue. All white, rough people are not blue. Nice, big people are not white. All smart, nice people are rough.",Dave is not white.,False,OWA,train,5,AttNeg-OWA-D5-1194,5,7,8,0,1,inv-proof,[(triple4)]
43675,43676,1,11815,The bear chases the cat. The cat sees the bear. The rabbit is cold. The squirrel is young. The squirrel needs the bear. The squirrel needs the rabbit. The squirrel sees the rabbit. If something chases the bear and it is cold then it chases the cat. If something needs the rabbit and it chases the cat then it sees the bear. If something is cold and it chases the squirrel then the squirrel needs the rabbit. If something is kind then it chases the bear. If the cat chases the rabbit and the rabbit needs the bear then the bear chases the cat. If something is young then it needs the rabbit. If something chases the squirrel and the squirrel chases the bear then the squirrel sees the cat. If something needs the rabbit and the rabbit sees the cat then the cat needs the rabbit.,The rabbit is not cold.,False,OWA,train,0,RelNoneg-OWA-D0-5128,0,7,8,0,1,inv-proof,[(triple3)]
104381,4382,1,566,The cow is big. The cow is blue. The mouse chases the cow. The mouse is blue. The mouse likes the cow. The tiger is nice. The tiger needs the mouse. If something chases the tiger then the tiger chases the mouse. If the cow likes the tiger then the cow needs the tiger. If something needs the tiger then it likes the mouse. If something is blue and it likes the cow then the cow likes the mouse. If something chases the cow then the cow is red. If something is blue and it needs the tiger then the tiger chases the cow. If something needs the cow then it is young. If something is red then it chases the tiger.,The mouse does not chase the cow.,False,OWA,train,1,RelNoneg-OWA-D1-398,3,7,8,0,1,inv-proof,[(triple3)]
85685,15780,1,4246,"Charlie is big. Charlie is cold. Charlie is kind. Charlie is nice. Charlie is quiet. Charlie is rough. Charlie is round. If something is rough then it is big. If Charlie is cold and Charlie is kind then Charlie is rough. If Charlie is rough and Charlie is kind then Charlie is quiet. Quiet, kind things are cold. Nice, round things are quiet. Nice things are kind. If something is kind then it is nice. Big, round things are kind.",Charlie is not round.,False,OWA,test,0,AttNoneg-OWA-D0-2898,0,7,8,0,1,inv-proof,[(triple7)]
400137,78,1,4,"Anne is not kind. Anne is not rough. Anne is young. Charlie is kind. Dave is nice. Gary is nice. Gary is rough. All kind, young people are furry. If someone is white and not kind then they are not furry. If someone is white then they are young. If someone is nice and rough then they are white. If Charlie is nice then Charlie is rough. Kind, nice people are rough. If someone is kind then they are nice. If someone is kind and not white then they are cold.",Anne is rough.,False,OWA,train,5,AttNeg-OWA-D5-63,5,7,8,0,1,inv-proof,[(triple2)]
315629,15606,1,1087,"Bob is big. Bob is quiet. Fiona is not cold. Fiona is green. Fiona is not kind. Fiona is white. Gary is kind. If someone is quiet then they are cold. If Gary is young then Gary is not quiet. If Gary is white then Gary is not quiet. All green, big people are young. All green people are white. All kind people are big. White, kind people are green. If Gary is big then Gary is young.",Fiona is not green.,False,OWA,train,3,AttNeg-OWA-D3-642,3,7,8,0,1,inv-proof,[(triple4)]
63075,63076,1,17054,"Erin is furry. Erin is green. Erin is nice. Erin is quiet. Erin is rough. Erin is round. Erin is white. Nice people are rough. All round people are white. If someone is quiet and rough then they are round. If someone is round then they are rough. All nice people are quiet. If Erin is rough then Erin is white. If someone is furry then they are quiet. All nice, rough people are green.",Erin is not white.,False,OWA,train,0,AttNoneg-OWA-D0-4561,0,7,8,0,1,inv-proof,[(triple7 OR ((triple5) -> rule6) OR ((triple6) -> rule2) OR ((((triple3) -> rule1)) -> rule6) OR ((((triple6) -> rule4)) -> rule6) OR ((((triple4 triple5) -> rule3)) -> rule2) OR ((((triple4 ((triple3) -> rule1)) -> rule3)) -> rule2) OR ((((((triple1) -> rule7) triple5) -> rule3)) -> rule2) OR ((((((triple3) -> rule5) triple5) -> rule3)) -> rule2) OR ((((((triple1) -> rule7) ((triple3) -> rule1)) -> rule3)) -> rule2) OR ((((((triple3) -> rule5) ((triple3) -> rule1)) -> rule3)) -> rule2))]
344873,44850,1,3114,The bear is kind. The cow likes the squirrel. The squirrel likes the tiger. The squirrel visits the bear. The squirrel does not visit the cow. The tiger is not nice. The tiger visits the cow. If something is cold and it likes the bear then it visits the bear. If something chases the bear and the bear is kind then it likes the bear. If the tiger visits the cow then the tiger chases the squirrel. If something visits the bear then the bear likes the squirrel. If something likes the bear and it is not nice then the bear visits the squirrel. If something likes the bear then it visits the tiger. If something visits the cow then it chases the bear. If the bear likes the squirrel and the bear likes the tiger then the squirrel likes the cow.,The tiger does not visit the cow.,False,OWA,train,3,RelNeg-OWA-D3-1612,3,7,8,0,1,inv-proof,[(triple7)]
372951,3540,1,242,The cow needs the dog. The cow needs the squirrel. The cow sees the squirrel. The dog needs the cow. The squirrel likes the cow. The squirrel needs the cow. The squirrel sees the dog. If the squirrel needs the dog then the squirrel needs the cow. If the dog is rough and the dog likes the cow then the dog is round. If someone needs the dog then the dog needs the squirrel. If someone likes the dog then they are big. If someone likes the dog then they see the dog. If someone needs the cow and they need the squirrel then the cow likes the dog. If someone is big then they need the dog. If someone is green and they need the cow then the cow sees the squirrel.,The cow does not need the squirrel.,False,OWA,test,3,RelNoneg-OWA-D3-1469,3,7,8,0,1,inv-proof,[(triple2)]
88847,18942,1,5097,Charlie is cold. Charlie is not furry. Charlie is red. Charlie is not round. Charlie is white. Charlie is not young. Dave is rough. If someone is rough then they are cold. If someone is red then they are cold. If someone is white and round then they are young. If Dave is young and Dave is rough then Dave is not furry. Round people are rough. If someone is young then they are white. If someone is cold and not white then they are furry. If someone is cold then they are not furry.,Charlie is young.,False,OWA,test,0,AttNeg-OWA-D0-5807,2,7,8,0,1,inv-proof,[(triple6)]
31323,31324,1,8477,The bear is nice. The mouse visits the bear. The squirrel chases the tiger. The squirrel eats the mouse. The squirrel visits the tiger. The tiger chases the squirrel. The tiger visits the squirrel. If someone eats the mouse and the mouse chases the squirrel then the squirrel is kind. If the mouse chases the squirrel and the mouse eats the tiger then the mouse eats the bear. If someone is rough then they eat the mouse. If someone is red and they eat the tiger then they eat the bear. If the tiger visits the mouse and the tiger visits the squirrel then the squirrel visits the tiger. If the mouse is rough and the mouse eats the tiger then the mouse visits the tiger. If the tiger is nice and the tiger visits the bear then the tiger eats the mouse. If the bear visits the mouse then the bear is red.,The tiger does not chase the squirrel.,False,OWA,train,0,RelNoneg-OWA-D0-2420,0,7,8,0,1,inv-proof,[(triple6)]
340631,40608,1,2821,The bald eagle eats the rabbit. The bald eagle is cold. The bear chases the bald eagle. The cow eats the rabbit. The rabbit chases the bald eagle. The rabbit chases the cow. The rabbit eats the bald eagle. If someone is young and they eat the cow then they like the bald eagle. If the rabbit likes the bald eagle and the rabbit is blue then the bald eagle likes the rabbit. If someone chases the rabbit then they like the rabbit. If the bear chases the bald eagle then the bald eagle chases the rabbit. If someone eats the rabbit and the rabbit eats the bald eagle then the bald eagle eats the bear. If someone is green and they eat the rabbit then they chase the bear. If someone eats the bald eagle and the bald eagle likes the rabbit then they like the bald eagle. If someone chases the bear and the bear is cold then they eat the bear.,The bald eagle is not cold.,False,OWA,train,3,RelNoneg-OWA-D3-1039,3,7,8,0,1,inv-proof,[(triple2)]
187489,17874,1,2305,"Bob is big. Bob is kind. Charlie is blue. Charlie is nice. Charlie is rough. Dave is cold. Dave is rough. Cold, rough things are not nice. All rough, round things are nice. If Bob is big then Bob is kind. All cold things are rough. If something is round then it is rough. All nice, blue things are kind. Cold, big things are kind. If Bob is rough then Bob is not cold.",Charlie is not nice.,False,OWA,test,1,AttNeg-OWA-D1-2951,1,7,8,0,1,inv-proof,[(triple4)]
262853,62840,1,5670,"Bob is big. Bob is cold. Bob is nice. Charlie is young. Dave is cold. Dave is round. Fiona is young. All big things are nice. If something is young and round then it is big. If something is cold then it is kind. If something is kind and cold then it is big. All kind, white things are nice. If something is cold and nice then it is young. If Bob is kind and Bob is big then Bob is nice. If something is cold and white then it is nice.",Dave is not cold.,False,OWA,train,2,AttNoneg-OWA-D2-1501,4,7,8,0,1,inv-proof,[(triple5)]
5527,5528,1,1499,"Charlie is big. Charlie is nice. Dave is cold. Dave is furry. Dave is green. Dave is nice. Dave is rough. If someone is green then they are nice. Rough people are nice. All nice, cold people are furry. If Dave is cold then Dave is big. If someone is rough and cold then they are big. If Dave is green and Dave is cold then Dave is nice. All cold people are big. All cold, furry people are young.",Charlie is not big.,False,OWA,train,0,AttNoneg-OWA-D0-3742,1,7,8,0,1,inv-proof,[(triple1)]
332769,32746,1,2271,The bald eagle is round. The bald eagle sees the lion. The bald eagle sees the squirrel. The lion is round. The lion is young. The lion sees the bald eagle. The squirrel chases the bald eagle. If something sees the squirrel and it chases the bald eagle then the bald eagle sees the squirrel. If something visits the squirrel then the squirrel sees the bald eagle. If something sees the lion and it is round then the lion visits the squirrel. If the lion chases the bald eagle then the bald eagle sees the squirrel. If something is blue and round then it chases the bald eagle. If something visits the lion and it is blue then the lion visits the squirrel. If something sees the bald eagle then it is red. If something is rough and red then it is young.,The bald eagle does not see the squirrel.,False,OWA,train,3,RelNoneg-OWA-D3-1535,3,7,8,0,1,inv-proof,[(triple3)]
360563,60540,1,4204,"Anne is round. Anne is young. Erin is quiet. Gary is green. Gary is red. Gary is round. Harry is green. All blue, quiet people are round. If someone is blue then they are cold. Quiet people are cold. If someone is cold then they are young. If someone is red then they are blue. Blue people are round. Blue, young people are green. If someone is young and quiet then they are red.",Gary is not red.,False,OWA,train,3,AttNoneg-OWA-D3-1591,5,7,8,0,1,inv-proof,[(triple5)]
129687,29688,1,3839,"The cow is cold. The cow visits the dog. The cow visits the squirrel. The dog visits the cow. The squirrel is red. The squirrel visits the cow. The squirrel visits the dog. If someone chases the cow then the cow needs the squirrel. If someone is cold and blue then they chase the dog. If someone is kind and they chase the dog then the dog needs the cow. If someone visits the dog then the dog is kind. Red, blue people are cold. If someone visits the squirrel then the squirrel is cold. If someone visits the dog and they chase the squirrel then the dog is rough. If someone visits the dog then they chase the squirrel.",The squirrel is not red.,False,OWA,train,1,RelNoneg-OWA-D1-2205,2,7,8,0,1,inv-proof,[(triple5)]
323517,23494,1,1630,Anne is cold. Anne is nice. Anne is quiet. Charlie is cold. Charlie is quiet. Charlie is white. Dave is big. If Anne is round then Anne is not quiet. If something is white then it is cold. If something is quiet and not big then it is not nice. All white things are nice. If something is blue and not round then it is nice. If Dave is quiet then Dave is nice. All cold things are not blue. All big things are white.,Anne is not nice.,False,OWA,train,3,AttNeg-OWA-D3-1517,3,7,8,0,1,inv-proof,[(triple2)]
460947,60888,1,2897,"Anne is blue. Anne is furry. Anne is quiet. Erin is young. Gary is quiet. Harry is furry. Harry is quiet. Blue, kind things are furry. All kind things are smart. Young things are blue. If something is blue then it is kind. White, blue things are young. If Anne is white then Anne is not young. Smart, young things are quiet. Quiet, young things are white.",Harry is not furry.,False,OWA,train,5,AttNeg-OWA-D5-1059,5,7,8,0,1,inv-proof,[(triple6)]
214489,14476,1,1303,The cow likes the squirrel. The dog is not big. The dog is round. The mouse is blue. The mouse does not like the squirrel. The squirrel eats the cow. The squirrel is not red. If the mouse likes the cow and the cow is blue then the mouse does not like the squirrel. If someone needs the squirrel and the squirrel is red then the squirrel is not round. If someone needs the cow then the cow eats the squirrel. If someone needs the squirrel then the squirrel is red. If someone eats the cow then they like the mouse. If someone is round then they eat the mouse. If the dog eats the mouse then the dog does not need the mouse. If someone needs the squirrel then the squirrel needs the mouse.,The cow does not like the squirrel.,False,OWA,train,2,RelNeg-OWA-D2-383,2,7,8,0,1,inv-proof,[(triple1)]
18571,18572,1,5025,"Harry is blue. Harry is cold. Harry is furry. Harry is nice. Harry is red. Harry is rough. Harry is young. All young things are furry. If Harry is rough and Harry is furry then Harry is young. Furry things are rough. Blue, nice things are red. Red things are furry. If something is young and furry then it is red. If Harry is red then Harry is young. All red things are blue.",Harry is not cold.,False,OWA,train,0,AttNoneg-OWA-D0-2329,0,7,8,0,1,inv-proof,[(triple2)]
87895,17990,1,4840,"Bob is cold. Charlie is cold. Charlie is furry. Charlie is white. Harry is big. Harry is cold. Harry is kind. If something is smart then it is kind. If something is kind then it is smart. If Bob is big then Bob is nice. Kind things are big. All kind, white things are big. All cold things are smart. Nice things are white. Smart, cold things are nice.",Harry is not big.,False,OWA,test,0,AttNoneg-OWA-D0-11,3,7,8,0,1,inv-proof,[(triple5 OR ((triple7) -> rule4) OR ((((((triple6) -> rule6)) -> rule1)) -> rule4) OR ((triple7 ((((((triple6) -> rule6) triple6) -> rule8)) -> rule7)) -> rule5) OR ((triple7 ((((((triple7) -> rule2) triple6) -> rule8)) -> rule7)) -> rule5) OR ((((((triple6) -> rule6)) -> rule1) ((((((triple6) -> rule6) triple6) -> rule8)) -> rule7)) -> rule5) OR ((((((triple6) -> rule6)) -> rule1) ((((((triple7) -> rule2) triple6) -> rule8)) -> rule7)) -> rule5))]
88817,18912,1,5089,"Anne is big. Anne is rough. Anne is smart. Anne is not young. Bob is green. Fiona is not big. Fiona is not smart. If something is nice and not young then it is not big. If something is green and big then it is not rough. If something is young and cold then it is green. If something is big and young then it is not green. If Bob is young and Bob is not cold then Bob is not big. If something is green and not rough then it is smart. If something is green and not big then it is smart. All green, rough things are smart.",Anne is not big.,False,OWA,test,0,AttNeg-OWA-D0-5095,0,7,8,0,1,inv-proof,[(triple1)]
205861,5848,1,529,The bald eagle is green. The bald eagle visits the dog. The cow likes the bald eagle. The cow likes the dog. The cow sees the dog. The dog likes the cow. The dog sees the bald eagle. If someone sees the dog then the dog likes the bald eagle. If someone sees the dog then the dog visits the bald eagle. If someone is green then they like the dog. If someone sees the dog then the dog likes the cow. If someone visits the dog and the dog sees the cow then the cow sees the dog. If someone visits the bald eagle and the bald eagle likes the dog then the bald eagle visits the cow. If the bald eagle visits the dog and the dog visits the cow then the cow sees the bald eagle. If someone sees the dog then they are nice.,The cow does not like the dog.,False,OWA,train,2,RelNoneg-OWA-D2-165,2,7,8,0,1,inv-proof,[(triple4)]
478869,9000,1,427,"Anne is green. Bob is not green. Bob is red. Bob is round. Fiona is not kind. Fiona is young. Gary is cold. Young, round people are kind. If someone is quiet and green then they are round. If someone is cold and red then they are not round. Red people are young. If Gary is round and Gary is young then Gary is kind. If Anne is quiet and Anne is round then Anne is red. Green people are quiet. If Bob is cold then Bob is not quiet.",Bob is green.,False,OWA,test,5,AttNeg-OWA-D5-461,5,7,8,0,1,inv-proof,[(triple2)]
407911,7852,1,375,"Anne is cold. Anne is quiet. Dave is cold. Dave is not quiet. Fiona is nice. Gary is not blue. Gary is round. If someone is blue then they are not rough. If Anne is cold then Anne is blue. If someone is cold and not blue then they are not nice. Nice, cold people are round. If Anne is not rough then Anne is nice. If someone is round and not nice then they are big. Cold, round people are big. All rough, cold people are big.",Anne is not cold.,False,OWA,train,5,AttNeg-OWA-D5-679,5,7,8,0,1,inv-proof,[(triple1)]
