,nr,q_nr,theory_nr,theory,question,answer,meta_folder,meta_file,meta_depth,meta_id,D_maxD,D_NFact,D_NRule,Q_Dep,Q_Len,Q_strategy,Q_proofs
485530,15661,6,741,The bald eagle chases the rabbit. The bald eagle eats the rabbit. The bald eagle is nice. The mouse eats the bald eagle. The rabbit likes the mouse. The squirrel eats the bald eagle. The squirrel eats the mouse. If something likes the squirrel then the squirrel chases the mouse. If something is young then it eats the bald eagle. If something chases the squirrel then the squirrel eats the rabbit. If something likes the mouse then it chases the bald eagle. If something likes the rabbit then the rabbit is young. If something chases the rabbit and the rabbit chases the bald eagle then it likes the rabbit. If something eats the bald eagle then it chases the rabbit. If something likes the mouse then it chases the mouse.,The rabbit is young.,True,OWA,test,5,RelNoneg-OWA-D5-347,6,7,8,3,5,proof,[(((((triple1 ((triple5) -> rule4)) -> rule6)) -> rule5) OR ((((((triple4) -> rule7) ((triple5) -> rule4)) -> rule6)) -> rule5) OR ((((((triple6) -> rule7) ((triple5) -> rule4)) -> rule6)) -> rule5))]
384776,15365,6,1058,The cow eats the tiger. The cow is nice. The cow needs the tiger. The squirrel sees the tiger. The tiger eats the cow. The tiger eats the squirrel. The tiger is green. If something sees the tiger then it is round. If the cow is nice then the cow needs the squirrel. If the tiger is rough and the tiger is red then the tiger sees the squirrel. If something needs the cow and it eats the tiger then the cow is round. If something is rough then it needs the squirrel. If something needs the squirrel then the squirrel is rough. If something needs the tiger then it is round. If something needs the tiger and it needs the cow then the tiger eats the cow.,The squirrel needs the squirrel.,True,OWA,test,3,RelNoneg-OWA-D3-1011,3,7,8,3,4,proof,[(((((((triple2) -> rule2)) -> rule6)) -> rule5))]
362322,62299,6,4327,"Bob is quiet. Bob is white. Charlie is green. Charlie is quiet. Charlie is smart. Fiona is white. Harry is quiet. If someone is cold and smart then they are white. If someone is quiet then they are cold. White, smart people are kind. All quiet, red people are white. All smart, white people are kind. If someone is red and green then they are kind. Cold people are smart. If Bob is white then Bob is red.",Bob is kind.,True,OWA,train,3,AttNoneg-OWA-D3-1793,4,7,8,3,5,proof,[(((triple2 ((((triple1) -> rule2)) -> rule7)) -> rule3) OR ((((((triple1) -> rule2)) -> rule7) triple2) -> rule5) OR ((((((triple1) -> rule2)) -> rule7) ((((triple1) -> rule2) ((((triple1) -> rule2)) -> rule7)) -> rule1)) -> rule5) OR ((((((triple1) -> rule2) ((((triple1) -> rule2)) -> rule7)) -> rule1) ((((triple1) -> rule2)) -> rule7)) -> rule3))]
476162,6293,6,297,"Dave is green. Dave is quiet. Dave is young. Erin is blue. Erin is white. Gary is quiet. Harry is blue. If something is cold and green then it is kind. All quiet things are green. If something is cold then it is kind. If something is quiet and kind then it is white. If something is cold then it is quiet. If Dave is cold then Dave is kind. All green things are cold. All cold, white things are young.",Gary is kind.,True,OWA,test,5,AttNoneg-OWA-D5-1224,5,7,8,3,4,proof,[(((((((triple6) -> rule2)) -> rule7)) -> rule3) OR ((((((triple6) -> rule2)) -> rule7) ((triple6) -> rule2)) -> rule1))]
450136,50077,6,2385,The bear is kind. The bear is round. The dog is red. The dog is round. The rabbit is red. The squirrel is rough. The squirrel needs the bear. If something eats the squirrel and the squirrel eats the rabbit then the squirrel is kind. If something is kind then it needs the squirrel. If something is cold and it needs the rabbit then it is round. If something needs the squirrel then it is red. All cold things are round. If the bear visits the squirrel and the squirrel eats the bear then the squirrel eats the dog. All rough things are cold. All round things are kind.,The squirrel is kind.,True,OWA,train,5,RelNoneg-OWA-D5-355,5,7,8,3,4,proof,[(((((((triple6) -> rule7)) -> rule5)) -> rule8))]
467464,67405,6,3209,The bear chases the mouse. The bear is rough. The bear visits the rabbit. The lion sees the mouse. The mouse is big. The rabbit chases the mouse. The rabbit visits the lion. If something sees the bear and the bear is kind then it chases the rabbit. If something sees the lion then the lion chases the rabbit. If something chases the lion then the lion chases the mouse. If something visits the mouse then the mouse visits the lion. If something chases the bear and the bear sees the mouse then the bear visits the rabbit. If something sees the lion then it visits the mouse. If something chases the lion and the lion is big then the lion visits the rabbit. If something visits the lion then it sees the lion.,The mouse visits the lion.,True,OWA,train,5,RelNoneg-OWA-D5-968,5,7,8,3,4,proof,[(((((((triple7) -> rule8)) -> rule6)) -> rule4))]
311614,11591,6,812,The bald eagle chases the squirrel. The bald eagle is big. The bald eagle likes the squirrel. The bald eagle needs the squirrel. The squirrel chases the bald eagle. The squirrel is red. The squirrel is round. If someone chases the bald eagle and the bald eagle needs the squirrel then the squirrel needs the bald eagle. If someone likes the squirrel and they are not nice then the squirrel needs the bald eagle. If the bald eagle needs the squirrel and the bald eagle likes the squirrel then the squirrel needs the bald eagle. If someone is big then they need the bald eagle. If someone is big and rough then they chase the squirrel. Rough people are round. If someone is big then they like the squirrel. If the squirrel chases the bald eagle and the squirrel needs the bald eagle then the squirrel is big.,The squirrel likes the squirrel.,True,OWA,train,3,RelNeg-OWA-D3-243,3,7,8,3,6,proof,[(((((triple5 ((triple4 triple3) -> rule3)) -> rule8)) -> rule7) OR ((((triple5 ((triple5 triple4) -> rule1)) -> rule8)) -> rule7) OR ((((triple5 ((triple4 ((triple2) -> rule7)) -> rule3)) -> rule8)) -> rule7))]
432986,32927,6,1571,The bear chases the rabbit. The cat needs the rabbit. The dog chases the cat. The dog is big. The dog is cold. The rabbit eats the cat. The rabbit does not need the cat. If something eats the bear then it eats the rabbit. If something eats the dog then it chases the bear. If something chases the bear then the bear needs the rabbit. If something needs the rabbit then it eats the dog. If something is big and it eats the dog then it does not chase the dog. If the rabbit chases the bear then the rabbit needs the dog. If something is cold and not big then it does not eat the bear. If the bear chases the cat and the bear chases the dog then the dog does not need the bear.,The bear needs the rabbit.,True,OWA,train,5,RelNeg-OWA-D5-322,5,7,8,3,4,proof,[(((((((triple2) -> rule4)) -> rule2)) -> rule3))]
369378,69355,6,4813,The bald eagle sees the bear. The bear chases the bald eagle. The bear does not chase the cat. The bear is not kind. The bear needs the cat. The cat is red. The cat sees the bald eagle. If someone is big then they do not need the bald eagle. If someone is red then they need the bear. If someone sees the bear then they are big. If someone chases the bald eagle and they need the cat then the cat sees the bear. If someone is cold and not kind then they see the bald eagle. If someone needs the bald eagle and they see the bald eagle then they see the bear. If someone chases the cat then the cat sees the bald eagle. If someone chases the bear and they are not red then the bear sees the bald eagle.,The cat does not need the bald eagle.,True,OWA,train,3,RelNeg-OWA-D3-165,3,7,8,3,5,proof,[(((((((triple2 triple5) -> rule4)) -> rule3)) -> rule1))]
453354,53295,6,2534,Bob is round. Dave is green. Dave is round. Erin is nice. Harry is green. Harry is rough. Harry is round. Kind things are nice. If something is kind and green then it is nice. If something is green then it is cold. All round things are white. Cold things are round. If something is rough and nice then it is green. If Harry is white then Harry is round. If something is nice then it is rough.,Erin is cold.,True,OWA,train,5,AttNeg-OWA-D5-621,5,7,8,3,5,proof,[(((((((triple4) -> rule8) triple4) -> rule6)) -> rule3))]
355154,55131,6,3829,"Bob is round. Dave is big. Dave is white. Fiona is rough. Fiona is white. Gary is big. Gary is white. Smart people are big. If someone is white then they are smart. If someone is big then they are blue. If Bob is rough then Bob is smart. If someone is blue and not white then they are not kind. Round, blue people are kind. If someone is blue and not rough then they are kind. If someone is rough and not smart then they are round.",Fiona is blue.,True,OWA,train,3,AttNeg-OWA-D3-1569,3,7,8,3,4,proof,[(((((((triple5) -> rule2)) -> rule1)) -> rule3))]
365744,65721,6,4563,The bear eats the dog. The bear is big. The bear is kind. The bear is red. The bear likes the dog. The dog eats the bear. The dog likes the bear. If something eats the bear then it is young. If something is red then it eats the bear. If something is green then it chases the bear. If something likes the bear then the bear is big. If something eats the dog and it is young then the dog is green. If something is green and it chases the dog then it likes the dog. If something is red and it eats the dog then the dog chases the bear. If something likes the dog and the dog does not like the bear then the bear is not kind.,The dog is green.,True,OWA,train,3,RelNeg-OWA-D3-520,3,7,8,3,5,proof,[(((triple1 ((((triple4) -> rule2)) -> rule1)) -> rule5))]
341968,41945,6,2914,"Bob is cold. Bob is kind. Harry is green. Harry is kind. Harry is round. Harry is white. Harry is young. Green things are white. If Bob is not kind then Bob is red. All kind things are green. If Harry is green then Harry is round. If something is round and not white then it is cold. If something is cold then it is young. All kind, white things are red. If something is green and not young then it is not red.",Bob is red.,True,OWA,train,3,AttNeg-OWA-D3-263,3,7,8,3,5,proof,[(((triple2 ((((triple2) -> rule3)) -> rule1)) -> rule7))]
370996,1585,6,107,"The bear chases the mouse. The bear is big. The bear is red. The bear is round. The bear visits the mouse. The mouse needs the bear. The mouse visits the bear. All round things are big. If something visits the mouse and the mouse is blue then the mouse is red. If something needs the mouse then the mouse chases the bear. If something is round then it needs the mouse. All red, cold things are blue. If something needs the bear and the bear visits the mouse then the bear needs the mouse. If something chases the mouse and it needs the bear then the mouse needs the bear. If something chases the bear and the bear visits the mouse then it is cold.",The mouse is cold.,True,OWA,test,3,RelNoneg-OWA-D3-661,3,7,8,3,5,proof,[(((((((triple4) -> rule4)) -> rule3) triple5) -> rule8) OR ((((((triple6 triple5) -> rule6)) -> rule3) triple5) -> rule8))]
420176,20117,6,959,"Anne is big. Anne is nice. Anne is white. Dave is big. Dave is not rough. Gary is not young. Harry is not white. If something is young and not big then it is white. All rough things are white. All young things are white. If something is rough and not big then it is white. If Dave is big then Dave is young. All young, red things are furry. If something is nice then it is red. If Dave is big and Dave is white then Dave is nice.",Dave is nice.,True,OWA,train,5,AttNeg-OWA-D5-508,5,7,8,3,5,proof,[(((triple4 ((((triple4) -> rule5)) -> rule3)) -> rule8))]
382664,13253,6,916,Erin is red. Fiona is big. Fiona is blue. Fiona is cold. Fiona is kind. Fiona is not quiet. Gary is big. If someone is red then they are not big. Cold people are big. All red people are furry. If someone is blue then they are kind. If Fiona is red and Fiona is not big then Fiona is furry. Kind people are blue. If someone is furry then they are blue. All furry people are quiet.,Erin is kind.,True,OWA,test,3,AttNeg-OWA-D3-181,3,7,8,3,4,proof,[(((((((triple1) -> rule3)) -> rule7)) -> rule4))]
392500,2743,6,189,The cow eats the lion. The cow is round. The cow visits the tiger. The lion eats the cow. The lion is nice. The squirrel is cold. The tiger is green. If something sees the cow then the cow sees the lion. If something eats the cow then the cow is green. If the lion sees the squirrel then the lion is green. If something visits the cow then it is nice. If the cow visits the squirrel and the cow sees the squirrel then the cow sees the lion. If something sees the cow then the cow is round. If the cow is cold then the cow sees the lion. If something is green then it is cold.,The cow sees the lion.,True,OWA,dev,3,RelNoneg-OWA-D3-1512,3,7,8,3,4,proof,[(((((((triple4) -> rule2)) -> rule8)) -> rule7))]
356382,56359,6,3913,The squirrel chases the tiger. The squirrel is big. The squirrel likes the tiger. The squirrel sees the tiger. The tiger is kind. The tiger is not nice. The tiger sees the squirrel. If the tiger is nice then the tiger likes the squirrel. If someone chases the tiger and the tiger sees the squirrel then the tiger likes the squirrel. If someone chases the tiger then they see the tiger. If someone likes the squirrel then they chase the tiger. If someone is kind and they like the squirrel then they are round. If the squirrel likes the tiger and the squirrel sees the tiger then the tiger chases the squirrel. If someone is kind and they like the tiger then the tiger does not chase the squirrel. If someone is nice then they are cold.,The tiger sees the tiger.,True,OWA,train,3,RelNeg-OWA-D3-760,3,7,8,3,5,proof,[(((((((triple1 triple7) -> rule2)) -> rule4)) -> rule3))]
344146,44123,6,3064,The cat sees the rabbit. The dog chases the rabbit. The dog is not blue. The dog is rough. The rabbit chases the dog. The rabbit likes the dog. The rabbit does not see the cat. If the rabbit sees the dog and the dog likes the rabbit then the rabbit is rough. If the cat chases the rabbit then the rabbit is rough. If something chases the cat and it sees the cat then the cat chases the rabbit. If the rabbit does not see the cat then the cat chases the rabbit. If something is rough then it likes the cat. If something is big then it sees the rabbit. If the dog chases the cat then the cat is not green. If the dog is blue and the dog is big then the dog is green.,The rabbit likes the cat.,True,OWA,train,3,RelNeg-OWA-D3-1241,3,7,8,3,4,proof,[(((((((triple7) -> rule4)) -> rule2)) -> rule5))]
469246,69187,6,3292,"Anne is young. Erin is big. Erin is furry. Fiona is big. Fiona is red. Harry is quiet. Harry is smart. All smart things are quiet. If something is young then it is quiet. If something is cold and not big then it is not red. All big things are red. Young, quiet things are furry. All quiet things are smart. If something is red then it is young. All smart things are cold.",Fiona is smart.,True,OWA,train,5,AttNeg-OWA-D5-789,5,7,8,3,4,proof,[(((((((triple5) -> rule7)) -> rule2)) -> rule6) OR ((((((((triple4) -> rule4)) -> rule7)) -> rule2)) -> rule6))]
365642,65619,6,4556,"Charlie is furry. Erin is furry. Erin is green. Erin is red. Fiona is green. Fiona is rough. Gary is red. If someone is rough and kind then they are red. Cold, furry people are red. If Gary is green then Gary is rough. Furry people are blue. Rough people are kind. Kind people are furry. All kind people are furry. Green people are cold.",Fiona is blue.,True,OWA,train,3,AttNoneg-OWA-D3-631,3,7,8,3,4,proof,[(((((((triple6) -> rule5)) -> rule6)) -> rule4) OR ((((((triple6) -> rule5)) -> rule7)) -> rule4))]
445652,45593,6,2167,"Anne is round. Erin is not young. Fiona is not green. Fiona is kind. Fiona is not round. Harry is green. Harry is round. Green people are kind. If someone is quiet and round then they are kind. All green people are kind. If someone is green and kind then they are quiet. If Anne is smart and Anne is young then Anne is kind. If Anne is round then Anne is green. If someone is kind and white then they are smart. All quiet, round people are white.",Harry is white.,True,OWA,train,5,AttNeg-OWA-D5-1188,5,7,8,3,6,proof,[(((((triple6 ((triple6) -> rule1)) -> rule4) triple7) -> rule8) OR ((((triple6 ((triple6) -> rule3)) -> rule4) triple7) -> rule8))]
316178,16155,6,1125,The cow eats the lion. The cow is round. The cow sees the lion. The lion eats the cow. The lion is green. The lion sees the cow. The lion visits the cow. Rough things are green. If something sees the lion and the lion visits the cow then it eats the cow. If something sees the lion and it visits the cow then the lion sees the cow. If the lion sees the cow and the cow sees the lion then the lion is young. If something eats the cow and the cow is round then it visits the cow. If the lion is rough then the lion sees the cow. If something visits the cow then it is green. If the cow visits the lion then the cow sees the lion.,The cow is green.,True,OWA,train,3,RelNoneg-OWA-D3-847,3,7,8,3,6,proof,[(((((((triple3 triple7) -> rule2) triple2) -> rule5)) -> rule7) OR ((((((triple3 ((triple4 triple2) -> rule5)) -> rule2) triple2) -> rule5)) -> rule7))]
437136,37077,6,1768,"Dave is nice. Erin is quiet. Gary is round. Gary is not smart. Harry is kind. Harry is nice. Harry is red. Red, quiet things are young. If something is kind and smart then it is not young. Nice things are young. All red, kind things are quiet. If something is young and round then it is kind. Red things are nice. If something is round then it is red. Young things are red.",Gary is young.,True,OWA,train,5,AttNeg-OWA-D5-790,5,7,8,3,4,proof,[(((((((triple3) -> rule7)) -> rule6)) -> rule3))]
443818,43759,6,2080,"Anne is blue. Anne is cold. Anne is nice. Dave is not cold. Dave is nice. Fiona is quiet. Harry is white. If someone is cold and not nice then they are not big. If someone is rough and quiet then they are big. If someone is nice and not white then they are big. All cold, nice people are rough. All blue people are rough. If someone is white then they are blue. Big people are cold. If someone is rough then they are quiet.",Anne is big.,True,OWA,train,5,AttNeg-OWA-D5-349,5,7,8,3,6,proof,[(((((triple1) -> rule5) ((((triple1) -> rule5)) -> rule8)) -> rule2) OR ((((triple1) -> rule5) ((((triple2 triple3) -> rule4)) -> rule8)) -> rule2) OR ((((triple2 triple3) -> rule4) ((((triple1) -> rule5)) -> rule8)) -> rule2) OR ((((triple2 triple3) -> rule4) ((((triple2 triple3) -> rule4)) -> rule8)) -> rule2))]
393538,3781,6,263,The dog chases the squirrel. The dog is rough. The dog sees the rabbit. The rabbit is green. The rabbit likes the squirrel. The rabbit sees the dog. The squirrel sees the rabbit. If something is green then it chases the squirrel. If something sees the rabbit and it likes the dog then the rabbit likes the squirrel. If the dog sees the rabbit and the dog chases the rabbit then the rabbit chases the squirrel. If the rabbit chases the dog then the dog chases the rabbit. If something sees the dog and it chases the squirrel then the squirrel chases the rabbit. If something is cold then it chases the dog. If something likes the rabbit then it sees the squirrel. If something chases the squirrel and it likes the squirrel then it likes the rabbit.,The rabbit sees the squirrel.,True,OWA,dev,3,RelNoneg-OWA-D3-341,3,7,8,3,5,proof,[(((((((triple4) -> rule1) triple5) -> rule8)) -> rule7))]
388114,18703,6,1293,The cow eats the tiger. The cow is red. The cow likes the tiger. The rabbit is rough. The squirrel is cold. The tiger is blue. The tiger likes the rabbit. If the rabbit chases the cow and the rabbit is not green then the rabbit is blue. If someone is red then they chase the squirrel. If the tiger is red and the tiger does not like the cow then the tiger is cold. If the rabbit eats the squirrel then the rabbit does not chase the cow. If someone chases the squirrel then the squirrel chases the tiger. If someone is red and they do not eat the rabbit then they like the rabbit. If someone chases the tiger then the tiger chases the cow. If the tiger is not green then the tiger does not like the squirrel.,The tiger chases the cow.,True,OWA,test,3,RelNeg-OWA-D3-1608,3,7,8,3,4,proof,[(((((((triple2) -> rule2)) -> rule5)) -> rule7))]
449474,49415,6,2353,"Anne is green. Anne is round. Charlie is green. Erin is green. Gary is big. Gary is kind. Gary is round. If Erin is green then Erin is young. All blue people are furry. All big people are blue. If someone is round then they are big. Blue, round people are young. If someone is young then they are round. If someone is round and green then they are young. If someone is blue then they are round.",Erin is big.,True,OWA,train,5,AttNoneg-OWA-D5-1162,5,7,8,3,4,proof,[(((((((triple4) -> rule1)) -> rule6)) -> rule4))]
408114,8055,6,384,"Charlie is nice. Dave is cold. Dave is not red. Dave is not rough. Dave is not smart. Gary is blue. Harry is big. Rough things are smart. Red, nice things are smart. All big things are rough. All nice, red things are rough. If Harry is smart and Harry is big then Harry is blue. If Charlie is red then Charlie is blue. All blue, smart things are nice. All nice, rough things are not cold.",Harry is blue.,True,OWA,train,5,AttNeg-OWA-D5-955,5,7,8,3,5,proof,[(((((((triple7) -> rule3)) -> rule1) triple7) -> rule5))]
451300,51241,6,2438,"Anne is round. Bob is cold. Bob is smart. Erin is cold. Erin is round. Harry is big. Harry is red. All white things are furry. If something is smart then it is big. If something is big and round then it is white. Furry, red things are round. If Harry is round then Harry is cold. If something is red then it is smart. All round things are big. If something is white and furry then it is red.",Anne is furry.,True,OWA,train,5,AttNoneg-OWA-D5-466,5,7,8,3,5,proof,[(((((((triple1) -> rule7) triple1) -> rule3)) -> rule1))]
371932,2521,6,173,The bald eagle eats the cat. The cat is kind. The cow is round. The rabbit eats the bald eagle. The rabbit eats the cow. The rabbit is kind. The rabbit visits the bald eagle. If something needs the rabbit and the rabbit is round then it is green. If something is cold then it needs the rabbit. If something needs the cow then it visits the cow. If something is kind and it needs the bald eagle then it is round. If something eats the cat then the cat needs the cow. If something needs the cow and the cow visits the bald eagle then the bald eagle is green. If something needs the cat then the cat needs the rabbit. If something visits the cow then the cow eats the rabbit.,The cow eats the rabbit.,True,OWA,test,3,RelNoneg-OWA-D3-315,3,7,8,3,4,proof,[(((((((triple1) -> rule5)) -> rule3)) -> rule8))]
325766,25743,6,1789,"Bob is red. Bob is rough. Bob is young. Fiona is not kind. Gary is nice. Gary is quiet. Gary is rough. If Bob is rough and Bob is smart then Bob is quiet. If something is young and quiet then it is smart. If something is smart then it is young. Kind, young things are red. All red things are quiet. Kind, rough things are not quiet. If something is quiet and smart then it is not nice. If Fiona is not young then Fiona is not nice.",Bob is not nice.,True,OWA,train,3,AttNeg-OWA-D3-683,3,7,8,3,7,proof,[(((((triple1) -> rule5) ((triple3 ((triple1) -> rule5)) -> rule2)) -> rule7))]
305654,5631,6,397,"Bob is big. Bob is round. Charlie is cold. Charlie is kind. Charlie is round. Erin is cold. Gary is white. Nice things are kind. Cold things are white. All kind, cold things are big. Round, white things are nice. All round, green things are cold. All white things are nice. Big things are green. If Gary is cold and Gary is white then Gary is green.",Erin is kind.,True,OWA,train,3,AttNoneg-OWA-D3-234,5,7,8,3,4,proof,[(((((((triple6) -> rule2)) -> rule6)) -> rule1))]
316592,16569,6,1154,Charlie is big. Charlie is green. Charlie is kind. Charlie is quiet. Charlie is red. Charlie is round. Gary is blue. Blue things are quiet. If Gary is red then Gary is blue. If something is quiet then it is green. If something is blue and green then it is red. If Charlie is big and Charlie is round then Charlie is kind. If something is kind and not big then it is round. If something is kind and not blue then it is round. If something is green and not quiet then it is round.,Gary is red.,True,OWA,train,3,AttNeg-OWA-D3-1503,3,7,8,3,5,proof,[(((triple7 ((((triple7) -> rule1)) -> rule3)) -> rule4))]
476330,6461,6,306,The bald eagle likes the mouse. The mouse likes the bald eagle. The rabbit likes the mouse. The tiger chases the mouse. The tiger chases the rabbit. The tiger is big. The tiger sees the bald eagle. If the rabbit likes the tiger and the tiger sees the bald eagle then the rabbit is rough. If someone sees the rabbit then the rabbit likes the tiger. If someone likes the bald eagle and the bald eagle likes the rabbit then the rabbit is big. If someone likes the bald eagle then the bald eagle is rough. If the mouse chases the rabbit then the rabbit chases the tiger. If the rabbit sees the bald eagle then the bald eagle chases the rabbit. If someone is young and they chase the mouse then they see the mouse. If someone likes the mouse and they are rough then they see the rabbit.,The rabbit likes the tiger.,True,OWA,test,5,RelNoneg-OWA-D5-392,5,7,8,3,5,proof,[(((((triple1 ((triple2) -> rule4)) -> rule8)) -> rule2))]
