,nr,q_nr,theory_nr,theory,question,answer,meta_folder,meta_file,meta_depth,meta_id,D_maxD,D_NFact,D_NRule,Q_Dep,Q_Len,Q_strategy,Q_proofs
187645,18030,1,2325,The bald eagle chases the cat. The bald eagle is green. The bald eagle is young. The cat likes the lion. The lion chases the bald eagle. The lion chases the cat. The lion is young. If someone chases the bald eagle and they like the bald eagle then the bald eagle chases the lion. If someone likes the bald eagle and the bald eagle visits the cat then the cat visits the bald eagle. If someone is young and they visit the bald eagle then they are big. If someone likes the cat and they do not chase the cat then they visit the bald eagle. If the lion chases the bald eagle and the lion likes the cat then the bald eagle does not like the cat. If someone is young then they do not like the bald eagle. If someone likes the bald eagle then they are cold. If someone chases the cat and the cat is nice then they do not visit the cat.,The bald eagle does not chase the cat.,False,OWA,test,1,RelNeg-OWA-D1-1845,1,7,8,0,1,inv-proof,[(triple1)]
137379,37380,1,4831,The bald eagle chases the cat. The bald eagle does not need the cat. The cat does not chase the tiger. The cat sees the tiger. The tiger chases the bald eagle. The tiger chases the cat. The tiger is not rough. If something is nice and it needs the tiger then the tiger needs the bald eagle. If something chases the bald eagle and it is not big then the bald eagle chases the tiger. If something is cold then it does not see the tiger. If something is green then it chases the tiger. If something is cold then it sees the cat. If something is nice and it sees the tiger then the tiger chases the bald eagle. If something sees the tiger then the tiger needs the cat. If something is cold then it needs the bald eagle.,The tiger is rough.,False,OWA,train,1,RelNeg-OWA-D1-2214,1,7,8,0,1,inv-proof,[(triple7)]
454193,54134,1,2574,"Anne is blue. Anne is round. Dave is quiet. Fiona is kind. Fiona is quiet. Fiona is red. Gary is red. All round things are red. All red things are green. If something is quiet then it is rough. All round things are kind. If something is green then it is round. Rough, quiet things are blue. Blue, rough things are round. Blue, red things are round.",Anne is not blue.,False,OWA,train,5,AttNoneg-OWA-D5-731,5,7,8,0,1,inv-proof,[(triple1)]
65441,65442,1,17695,"Anne is not big. Anne is cold. Anne is nice. Anne is red. Anne is smart. Anne is white. Anne is not young. If Anne is big and Anne is cold then Anne is young. All young things are red. All nice, young things are not cold. Big things are young. All cold, white things are smart. If Anne is smart and Anne is not big then Anne is white. If Anne is young and Anne is smart then Anne is red. If Anne is not nice and Anne is not cold then Anne is smart.",Anne is big.,False,OWA,train,0,AttNeg-OWA-D0-6200,0,7,8,0,1,inv-proof,[(triple1)]
3681,3682,1,996,"Erin is blue. Erin is furry. Erin is green. Erin is nice. Erin is quiet. Erin is rough. Erin is round. If Erin is furry and Erin is rough then Erin is quiet. Quiet, green people are furry. If someone is green and nice then they are quiet. Blue people are round. Green people are rough. All round people are furry. If someone is furry and round then they are blue. Blue people are furry.",Erin is not blue.,False,OWA,train,0,AttNoneg-OWA-D0-6760,0,7,8,0,1,inv-proof,[(triple1 OR ((triple2 triple7) -> rule7) OR ((((triple7) -> rule6) triple7) -> rule7) OR ((((triple5 triple3) -> rule2) triple7) -> rule7) OR ((((((triple3 triple4) -> rule3) triple3) -> rule2) triple7) -> rule7))]
260911,60898,1,5497,The bald eagle eats the cat. The bald eagle visits the rabbit. The cat eats the rabbit. The cat is not rough. The lion is cold. The rabbit eats the cat. The rabbit does not visit the cat. If something visits the lion then the lion is red. If something eats the lion and the lion does not eat the rabbit then the lion does not need the bald eagle. If something visits the rabbit then the rabbit needs the lion. If something needs the rabbit then it is not red. If something eats the cat then the cat eats the lion. If something is nice then it eats the cat. If something is blue then it does not eat the cat. If something needs the lion then the lion visits the bald eagle.,The cat is rough.,False,OWA,train,2,RelNeg-OWA-D2-1587,2,7,8,0,1,inv-proof,[(triple4)]
85067,15162,1,4078,"Fiona is big. Fiona is green. Fiona is quiet. Fiona is round. Fiona is smart. Fiona is white. Fiona is young. If something is big then it is round. If Fiona is big then Fiona is green. Big, green things are white. If something is big then it is green. All round, smart things are green. All big, round things are quiet. If something is green and white then it is big. If something is quiet then it is round.",Fiona is not young.,False,OWA,test,0,AttNoneg-OWA-D0-4697,0,7,8,0,1,inv-proof,[(triple7)]
25703,25704,1,6958,Anne is not big. Anne is rough. Anne is round. Dave is big. Dave is blue. Dave is round. Harry is white. If something is white then it is not red. All furry things are round. If something is blue and rough then it is not round. If Harry is furry then Harry is not red. All white things are blue. All round things are furry. If Harry is rough then Harry is not big. If something is blue then it is big.,Anne is not round.,False,OWA,train,0,AttNeg-OWA-D0-1570,2,7,8,0,1,inv-proof,[(triple3)]
13989,13990,1,3792,Anne is big. Anne is cold. Anne is green. Anne is not nice. Anne is red. Anne is rough. Anne is white. If someone is nice then they are red. All green people are red. If someone is red and nice then they are cold. If Anne is white and Anne is not cold then Anne is not rough. If Anne is not nice then Anne is rough. If someone is cold then they are white. If someone is rough and cold then they are white. If someone is nice and not rough then they are big.,Anne is not big.,False,OWA,train,0,AttNeg-OWA-D0-4859,0,7,8,0,1,inv-proof,[(triple1)]
6895,6896,1,1871,"Erin is not blue. Erin is cold. Erin is nice. Erin is quiet. Erin is not red. Erin is round. Erin is young. If something is round then it is nice. If something is young and blue then it is not nice. All cold, round things are nice. If something is round and not quiet then it is not blue. Quiet, round things are not red. All blue things are cold. If something is red and not round then it is young. If something is quiet then it is young.",Erin is red.,False,OWA,train,0,AttNeg-OWA-D0-3154,0,7,8,0,1,inv-proof,[(triple5 OR ((triple4 triple6) -> rule5))]
59099,59100,1,15973,"Dave is blue. Dave is furry. Dave is quiet. Dave is rough. Dave is smart. Dave is white. Dave is young. All furry, young things are smart. All rough things are quiet. Furry, quiet things are rough. If Dave is white then Dave is furry. If something is quiet then it is rough. Young, blue things are quiet. All white things are furry. If something is smart and furry then it is young.",Dave is not rough.,False,OWA,train,0,AttNoneg-OWA-D0-6843,0,7,8,0,1,inv-proof,[(triple4 OR ((triple3) -> rule5) OR ((triple2 triple3) -> rule3) OR ((((triple7 triple1) -> rule6)) -> rule5) OR ((triple2 ((triple7 triple1) -> rule6)) -> rule3) OR ((((triple6) -> rule4) triple3) -> rule3) OR ((((triple6) -> rule7) triple3) -> rule3) OR ((((triple6) -> rule4) ((triple7 triple1) -> rule6)) -> rule3) OR ((((triple6) -> rule7) ((triple7 triple1) -> rule6)) -> rule3) OR ((((((triple5 triple2) -> rule8) triple1) -> rule6)) -> rule5) OR ((triple2 ((((triple5 triple2) -> rule8) triple1) -> rule6)) -> rule3) OR ((((triple6) -> rule4) ((((triple5 triple2) -> rule8) triple1) -> rule6)) -> rule3) OR ((((triple6) -> rule7) ((((triple5 triple2) -> rule8) triple1) -> rule6)) -> rule3) OR ((((((triple5 ((triple6) -> rule4)) -> rule8) triple1) -> rule6)) -> rule5) OR ((((((triple5 ((triple6) -> rule7)) -> rule8) triple1) -> rule6)) -> rule5) OR ((triple2 ((((triple5 ((triple6) -> rule4)) -> rule8) triple1) -> rule6)) -> rule3) OR ((triple2 ((((triple5 ((triple6) -> rule7)) -> rule8) triple1) -> rule6)) -> rule3) OR ((((triple6) -> rule4) ((((triple5 ((triple6) -> rule4)) -> rule8) triple1) -> rule6)) -> rule3) OR ((((triple6) -> rule4) ((((triple5 ((triple6) -> rule7)) -> rule8) triple1) -> rule6)) -> rule3) OR ((((triple6) -> rule7) ((((triple5 ((triple6) -> rule4)) -> rule8) triple1) -> rule6)) -> rule3) OR ((((triple6) -> rule7) ((((triple5 ((triple6) -> rule7)) -> rule8) triple1) -> rule6)) -> rule3))]
357239,57216,1,3971,The cat eats the cow. The cat is cold. The cat is rough. The cat likes the cow. The cat visits the cow. The cow eats the cat. The cow likes the cat. If the cat visits the cow and the cow likes the cat then the cat eats the cow. All cold people are nice. If someone is nice and they visit the cow then they are kind. If the cow visits the cat then the cat is rough. If someone visits the cat then the cat eats the cow. If someone is kind then they like the cat. If someone visits the cow and the cow eats the cat then they are rough. If the cat is kind then the cat likes the cow.,The cat is not rough.,False,OWA,train,3,RelNoneg-OWA-D3-95,3,7,8,0,1,inv-proof,[(triple3 OR ((triple5 triple6) -> rule7))]
342553,42530,1,2955,The cow sees the rabbit. The cow sees the squirrel. The rabbit chases the cow. The rabbit is red. The rabbit is round. The rabbit needs the squirrel. The squirrel is not big. If the rabbit is big then the rabbit sees the squirrel. If someone sees the rabbit then the rabbit does not need the cow. If someone sees the squirrel then they chase the cow. If someone needs the cow then they chase the cow. If the squirrel chases the rabbit and the rabbit is big then the rabbit needs the squirrel. If someone needs the squirrel and they see the squirrel then they are cold. If someone sees the rabbit and the rabbit does not chase the cow then the rabbit sees the cow. If the rabbit does not need the cow then the cow needs the squirrel.,The rabbit does not need the squirrel.,False,OWA,train,3,RelNeg-OWA-D3-330,3,7,8,0,1,inv-proof,[(triple6)]
278211,8122,1,734,The cow chases the squirrel. The cow chases the tiger. The cow likes the squirrel. The rabbit visits the tiger. The squirrel visits the cow. The tiger chases the rabbit. The tiger visits the rabbit. If someone is nice then they visit the tiger. If someone likes the squirrel then they like the cow. If the cow is rough then the cow likes the tiger. If someone is rough and they chase the tiger then the tiger chases the squirrel. If someone visits the tiger and the tiger is rough then they chase the cow. If someone chases the squirrel then they are round. If someone likes the cow and the cow likes the squirrel then they are red. If the squirrel visits the rabbit then the squirrel is green.,The tiger does not chase the rabbit.,False,OWA,test,2,RelNoneg-OWA-D2-2135,2,7,8,0,1,inv-proof,[(triple6)]
480297,10428,1,494,"Charlie is furry. Charlie is young. Dave is nice. Erin is kind. Erin is not nice. Harry is blue. Harry is nice. Quiet, blue things are kind. If Dave is quiet then Dave is furry. If something is blue and not nice then it is quiet. If something is nice then it is quiet. All young, kind things are round. If something is nice and kind then it is young. If Dave is not blue then Dave is quiet. If something is round then it is not furry.",Harry is not nice.,False,OWA,test,5,AttNeg-OWA-D5-1062,5,7,8,0,1,inv-proof,[(triple7)]
66353,66354,1,17935,"Dave is big. Dave is green. Dave is nice. Gary is big. Gary is blue. Gary is cold. Gary is green. If Dave is green and Dave is blue then Dave is cold. If someone is cold then they are blue. If someone is cold then they are big. Blue, quiet people are not nice. If someone is quiet and big then they are nice. Big, quiet people are not cold. If someone is nice then they are cold. All quiet, big people are not furry.",Dave is not nice.,False,OWA,train,0,AttNeg-OWA-D0-6900,2,7,8,0,1,inv-proof,[(triple3)]
73769,3864,1,1048,"Anne is blue. Anne is cold. Anne is kind. Anne is quiet. Anne is rough. Anne is smart. Anne is young. If someone is smart then they are blue. If Anne is young then Anne is quiet. All kind people are quiet. All quiet people are smart. Quiet people are blue. Blue people are young. If Anne is young and Anne is blue then Anne is quiet. Rough, young people are kind.",Anne is not smart.,False,OWA,test,0,AttNoneg-OWA-D0-6531,0,7,8,0,1,inv-proof,[(triple6 OR ((triple4) -> rule4) OR ((((triple3) -> rule3)) -> rule4) OR ((((triple7) -> rule2)) -> rule4) OR ((((triple7 triple1) -> rule7)) -> rule4) OR ((((((triple1) -> rule6)) -> rule2)) -> rule4) OR ((((((triple5 triple7) -> rule8)) -> rule3)) -> rule4) OR ((((((triple1) -> rule6) triple1) -> rule7)) -> rule4) OR ((((((triple5 ((triple1) -> rule6)) -> rule8)) -> rule3)) -> rule4))]
1633,1634,1,442,"Fiona is blue. Fiona is green. Fiona is quiet. Fiona is smart. Harry is not rough. Harry is round. Harry is smart. If something is round then it is quiet. Quiet, smart things are round. Green, rough things are round. If Fiona is blue and Fiona is quiet then Fiona is round. All blue things are kind. Rough things are kind. If something is rough then it is smart. If Fiona is quiet then Fiona is rough.",Fiona is not green.,False,OWA,train,0,AttNeg-OWA-D0-2058,1,7,8,0,1,inv-proof,[(triple2)]
449503,49444,1,2355,"Dave is big. Fiona is cold. Gary is not nice. Gary is round. Gary is white. Harry is not blue. Harry is nice. If Gary is blue and Gary is not nice then Gary is not white. Blue people are round. If someone is white and blue then they are not round. All cold people are round. Nice people are rough. Rough people are cold. All round, rough people are big. Big people are white.",Dave is not big.,False,OWA,train,5,AttNeg-OWA-D5-583,5,7,8,0,1,inv-proof,[(triple1)]
34607,34608,1,9365,"Anne is big. Anne is kind. Anne is red. Gary is big. Gary is red. Gary is rough. Harry is red. All quiet things are kind. All big, furry things are red. If something is big then it is rough. If something is rough then it is red. If something is rough then it is furry. If something is quiet then it is kind. If something is kind and furry then it is quiet. If something is furry then it is red.",Harry is not red.,False,OWA,train,0,AttNoneg-OWA-D0-3851,3,7,8,0,1,inv-proof,[(triple7)]
427543,27484,1,1312,Bob is rough. Dave is big. Fiona is green. Fiona is young. Gary is big. Gary is green. Gary is nice. All big things are young. If something is young then it is nice. Nice things are green. If Bob is not young then Bob is smart. If something is red then it is smart. If something is rough and young then it is red. If something is nice and green then it is red. If Bob is smart and Bob is big then Bob is green.,Bob is not rough.,False,OWA,train,5,AttNeg-OWA-D5-1095,5,7,8,0,1,inv-proof,[(triple1)]
154565,54566,1,7057,The cow chases the tiger. The cow is cold. The cow is not red. The cow visits the tiger. The tiger is big. The tiger is red. The tiger is not round. If the cow is cold then the cow is round. If the cow chases the tiger then the cow is not nice. If something likes the cow and it visits the cow then it likes the tiger. If something chases the cow then it does not like the cow. If something chases the tiger and it likes the cow then it is red. If something likes the tiger and the tiger is not nice then the tiger chases the cow. If the tiger does not visit the cow then the cow likes the tiger. If something chases the cow and the cow likes the tiger then it chases the tiger.,The cow does not visit the tiger.,False,OWA,train,1,RelNeg-OWA-D1-1358,1,7,8,0,1,inv-proof,[(triple4)]
253413,53400,1,4820,"Charlie is furry. Charlie is quiet. Erin is cold. Fiona is furry. Fiona is green. Gary is furry. Gary is young. If someone is blue then they are young. If Charlie is furry and Charlie is green then Charlie is smart. Smart people are young. If Charlie is blue then Charlie is furry. If someone is blue then they are green. Young, quiet people are green. Quiet, blue people are green. If someone is cold then they are blue.",Gary is not furry.,False,OWA,train,2,AttNoneg-OWA-D2-2104,2,7,8,0,1,inv-proof,[(triple6)]
