,nr,q_nr,theory_nr,theory,question,answer,meta_folder,meta_file,meta_depth,meta_id,D_maxD,D_NFact,D_NRule,Q_Dep,Q_Len,Q_strategy,Q_proofs
399097,9340,7,651,The cat chases the dog. The cat sees the dog. The dog is big. The lion chases the cat. The lion needs the cat. The lion needs the dog. The rabbit chases the cat. If the lion needs the rabbit then the rabbit sees the cat. If someone sees the dog and they need the dog then the dog needs the lion. If someone is blue and they see the rabbit then the rabbit is blue. If someone needs the lion and the lion chases the cat then they are rough. If someone sees the cat then they are big. If someone chases the dog then they need the dog. If someone is blue then they need the rabbit. If someone is cold and they chase the rabbit then they are blue.,The dog is not rough.,False,OWA,dev,3,RelNoneg-OWA-D3-1351,3,7,8,3,6,inv-proof,[(((((triple2 ((triple1) -> rule6)) -> rule2) triple4) -> rule4))]
433605,33546,7,1603,"Anne is red. Bob is kind. Bob is quiet. Charlie is not cold. Charlie is nice. Charlie is quiet. Fiona is kind. Kind things are cold. If something is blue then it is red. All quiet things are blue. Kind, nice things are blue. Cold things are nice. Red things are nice. If something is red then it is quiet. If Bob is green then Bob is not cold.",Fiona is not blue.,False,OWA,train,5,AttNeg-OWA-D5-769,5,7,8,3,5,inv-proof,[(((triple7 ((((triple7) -> rule1)) -> rule5)) -> rule4))]
460097,60038,7,2855,The bald eagle is rough. The cow visits the bald eagle. The cow visits the lion. The dog does not eat the cow. The dog sees the lion. The dog visits the bald eagle. The lion sees the bald eagle. If someone visits the lion then they are young. If the cow is rough then the cow eats the lion. If someone sees the cow then they are rough. If someone is cold then they are rough. If someone sees the dog then they are cold. If someone visits the lion then they see the dog. If someone eats the lion then the lion visits the bald eagle. If someone visits the lion and they are big then they eat the dog.,The cow is not rough.,False,OWA,train,5,RelNeg-OWA-D5-971,5,7,8,3,4,inv-proof,[(((((((triple3) -> rule6)) -> rule5)) -> rule4))]
386953,17542,7,1211,The bald eagle is young. The bald eagle needs the lion. The cow eats the bald eagle. The cow needs the bald eagle. The lion chases the cow. The lion eats the cow. The lion needs the bald eagle. If someone needs the cow and they eat the bald eagle then the bald eagle eats the lion. If someone needs the lion and they need the bald eagle then they chase the cow. If someone is cold then they need the bald eagle. If someone is round then they need the bald eagle. If someone eats the lion then they are round. If someone needs the bald eagle and the bald eagle is round then the bald eagle is rough. If someone needs the bald eagle then they are round. If someone is round then they need the lion.,The cow does not chase the cow.,False,OWA,test,3,RelNoneg-OWA-D3-1253,3,7,8,3,5,inv-proof,[(((((((triple4) -> rule7)) -> rule8) triple4) -> rule2))]
302195,2172,7,155,"Dave is cold. Erin is cold. Erin is green. Erin is quiet. Erin is red. Erin is young. Harry is smart. All big, smart things are young. If Erin is cold then Erin is red. If something is smart then it is big. If something is big and young then it is green. Smart, red things are young. Green things are cold. If Erin is big and Erin is cold then Erin is young. If something is young and green then it is cold.",Harry is not green.,False,OWA,train,3,AttNoneg-OWA-D3-1699,4,7,8,3,7,inv-proof,[(((((triple7) -> rule3) ((((triple7) -> rule3) triple7) -> rule1)) -> rule4))]
305655,5632,7,397,"Bob is big. Bob is round. Charlie is cold. Charlie is kind. Charlie is round. Erin is cold. Gary is white. Nice things are kind. Cold things are white. All kind, cold things are big. Round, white things are nice. All round, green things are cold. All white things are nice. Big things are green. If Gary is cold and Gary is white then Gary is green.",Erin is not kind.,False,OWA,train,3,AttNoneg-OWA-D3-234,5,7,8,3,4,inv-proof,[(((((((triple6) -> rule2)) -> rule6)) -> rule1))]
470911,1042,7,47,"Bob is kind. Erin is big. Erin is quiet. Fiona is kind. Fiona is rough. Gary is nice. Gary is smart. If something is quiet and smart then it is furry. Rough, big things are kind. If something is big and kind then it is quiet. If something is quiet and big then it is kind. Rough things are big. Smart things are kind. Nice, furry things are quiet. If something is kind then it is rough.",Bob is not quiet.,False,OWA,test,5,AttNoneg-OWA-D5-984,5,7,8,3,5,inv-proof,[(((((((triple1) -> rule8)) -> rule5) triple1) -> rule3))]
473237,3368,7,158,"Bob is blue. Dave is nice. Dave is white. Erin is blue. Erin is white. Fiona is big. Fiona is not nice. Big things are furry. Blue, nice things are furry. If something is white and kind then it is blue. Furry, round things are blue. All white things are round. If something is furry then it is white. Round things are white. If something is blue then it is kind.",Fiona is not round.,False,OWA,test,5,AttNeg-OWA-D5-561,5,7,8,3,4,inv-proof,[(((((((triple6) -> rule1)) -> rule6)) -> rule5))]
388115,18704,7,1293,The cow eats the tiger. The cow is red. The cow likes the tiger. The rabbit is rough. The squirrel is cold. The tiger is blue. The tiger likes the rabbit. If the rabbit chases the cow and the rabbit is not green then the rabbit is blue. If someone is red then they chase the squirrel. If the tiger is red and the tiger does not like the cow then the tiger is cold. If the rabbit eats the squirrel then the rabbit does not chase the cow. If someone chases the squirrel then the squirrel chases the tiger. If someone is red and they do not eat the rabbit then they like the rabbit. If someone chases the tiger then the tiger chases the cow. If the tiger is not green then the tiger does not like the squirrel.,The tiger does not chase the cow.,False,OWA,test,3,RelNeg-OWA-D3-1608,3,7,8,3,4,inv-proof,[(((((((triple2) -> rule2)) -> rule5)) -> rule7))]
425809,25750,7,1230,"Bob is white. Erin is kind. Gary is not kind. Gary is quiet. Harry is quiet. Harry is smart. Harry is white. All white people are smart. If someone is red and white then they are smart. Cold, kind people are smart. Cold people are not red. All blue, smart people are red. If someone is smart and kind then they are blue. If someone is white and smart then they are kind. If Bob is red then Bob is quiet.",Bob is not blue.,False,OWA,train,5,AttNeg-OWA-D5-447,5,7,8,3,7,inv-proof,[(((((triple1) -> rule1) ((triple1 ((triple1) -> rule1)) -> rule7)) -> rule6))]
461719,61660,7,2933,"Charlie is big. Dave is nice. Dave is young. Fiona is red. Harry is nice. Harry is quiet. Harry is red. All kind, red things are nice. If Dave is nice then Dave is big. All rough things are quiet. All red things are quiet. Quiet things are kind. Young, quiet things are red. If something is big then it is red. If something is nice and big then it is young.",Charlie is not kind.,False,OWA,train,5,AttNoneg-OWA-D5-1042,5,7,8,3,4,inv-proof,[(((((((triple1) -> rule7)) -> rule4)) -> rule5))]
386909,17498,7,1208,"Fiona is cold. Fiona is not furry. Fiona is green. Harry is big. Harry is cold. Harry is kind. Harry is white. If Harry is big then Harry is cold. Smart things are furry. If Fiona is furry and Fiona is kind then Fiona is not green. If Harry is kind then Harry is green. If Harry is kind and Harry is not cold then Harry is green. If something is green and not white then it is kind. If something is big and green then it is kind. All big, green things are smart.",Harry is not furry.,False,OWA,test,3,AttNeg-OWA-D3-761,3,7,8,3,5,inv-proof,[(((((triple4 ((triple6) -> rule4)) -> rule8)) -> rule2))]
382171,12760,7,880,Bob is rough. Charlie is not big. Charlie is blue. Charlie is smart. Charlie is white. Erin is green. Gary is big. All green people are not white. If Erin is kind and Erin is green then Erin is big. If someone is blue then they are rough. If someone is blue and not green then they are not big. If Charlie is smart then Charlie is blue. Green people are smart. Big people are not smart. If someone is smart and not white then they are blue.,Erin is not rough.,False,OWA,test,3,AttNeg-OWA-D3-1724,3,7,8,3,6,inv-proof,[(((((((triple6) -> rule6) ((triple6) -> rule1)) -> rule8)) -> rule3))]
364829,64806,7,4498,"Bob is smart. Dave is quiet. Dave is smart. Harry is blue. Harry is kind. Harry is quiet. Harry is smart. All furry people are nice. Quiet people are kind. If Bob is smart then Bob is quiet. All kind people are not furry. All kind people are quiet. Furry, nice people are quiet. If someone is kind and smart then they are white. If someone is nice and not furry then they are white.",Bob is not white.,False,OWA,train,3,AttNeg-OWA-D3-931,3,7,8,3,5,inv-proof,[(((((((triple1) -> rule3)) -> rule2) triple1) -> rule7))]
466683,66624,7,3172,Anne is furry. Anne is quiet. Anne is round. Dave is green. Erin is not blue. Gary is nice. Gary is quiet. All nice things are round. Furry things are kind. Green things are nice. All kind things are blue. If something is round and nice then it is furry. If something is green and not kind then it is quiet. If something is nice and not blue then it is not quiet. Round things are quiet.,Gary is not kind.,False,OWA,train,5,AttNeg-OWA-D5-982,5,7,8,3,5,inv-proof,[(((((((triple6) -> rule1) triple6) -> rule5)) -> rule2))]
338765,38742,7,2690,"Anne is cold. Anne is furry. Anne is red. Bob is red. Erin is furry. Erin is red. Erin is rough. If Anne is round and Anne is rough then Anne is nice. If someone is furry and rough then they are red. All round, furry people are cold. Smart, cold people are nice. All cold people are red. All round people are smart. If someone is furry then they are round. All nice, furry people are smart.",Anne is not nice.,False,OWA,train,3,AttNoneg-OWA-D3-1023,3,7,8,3,5,inv-proof,[(((((((triple2) -> rule7)) -> rule6) triple1) -> rule4) OR ((((((triple2) -> rule7)) -> rule6) ((((triple2) -> rule7) triple2) -> rule3)) -> rule4))]
360435,60412,7,4194,"Bob is kind. Bob is quiet. Bob is red. Bob is rough. Bob is smart. Harry is nice. Harry is quiet. If someone is quiet and rough then they are smart. If Bob is kind and Bob is quiet then Bob is nice. Rough people are kind. All quiet people are furry. Nice, smart people are red. All kind people are nice. Nice, furry people are rough. Quiet, kind people are furry.",Harry is not smart.,False,OWA,train,3,AttNoneg-OWA-D3-197,4,7,8,3,6,inv-proof,[(((triple7 ((triple6 ((triple7) -> rule4)) -> rule7)) -> rule1))]
362547,62524,7,4342,"Charlie is nice. Dave is big. Dave is nice. Dave is smart. Dave is white. Dave is young. Fiona is big. If Fiona is round then Fiona is young. If Fiona is nice and Fiona is round then Fiona is quiet. Smart things are nice. If Dave is white and Dave is nice then Dave is young. Quiet, round things are young. Nice things are smart. If something is quiet and nice then it is big. Smart things are quiet.",Charlie is not big.,False,OWA,train,3,AttNoneg-OWA-D3-1879,3,7,8,3,5,inv-proof,[(((((((triple1) -> rule6)) -> rule8) triple1) -> rule7))]
335707,35684,7,2478,The bald eagle is cold. The bald eagle likes the cat. The cat is cold. The cat is green. The cat is round. The cat likes the bald eagle. The cat visits the bald eagle. If someone is round then they visit the cat. If someone sees the bald eagle and they like the cat then they like the bald eagle. If someone visits the bald eagle and the bald eagle sees the cat then the bald eagle visits the cat. If someone visits the cat and they like the cat then they visit the bald eagle. If someone is kind and they like the cat then the cat is round. If someone visits the bald eagle then the bald eagle sees the cat. If the cat is round and the cat likes the bald eagle then the bald eagle sees the cat. If someone visits the bald eagle then they like the cat.,The bald eagle does not visit the bald eagle.,False,OWA,train,3,RelNoneg-OWA-D3-555,3,7,8,3,6,inv-proof,[(((((triple7 ((triple7) -> rule6)) -> rule3) triple2) -> rule4) OR ((((triple7 ((triple5 triple6) -> rule7)) -> rule3) triple2) -> rule4))]
378695,9284,7,640,The bald eagle visits the bear. The bald eagle visits the cow. The bald eagle visits the mouse. The bear needs the bald eagle. The cow eats the mouse. The cow is big. The mouse needs the bear. If someone visits the cow then they need the mouse. If someone needs the bald eagle and the bald eagle eats the mouse then the bald eagle is kind. If someone eats the mouse then they eat the cow. If the bald eagle is cold then the bald eagle needs the bear. If the bald eagle is red and the bald eagle needs the cow then the cow needs the mouse. If someone eats the cow and they are kind then they eat the bald eagle. If someone needs the mouse then the mouse visits the cow. If someone eats the bald eagle then they need the cow.,The mouse does not need the mouse.,False,OWA,test,3,RelNoneg-OWA-D3-65,3,7,8,3,4,inv-proof,[(((((((triple2) -> rule1)) -> rule7)) -> rule1))]
465411,65352,7,3112,Dave is kind. Fiona is big. Gary is big. Gary is blue. Gary is cold. Gary is rough. Harry is big. If Gary is cold then Gary is furry. All rough things are round. All furry things are round. If Harry is blue and Harry is round then Harry is furry. If something is big then it is rough. If something is furry then it is rough. If Harry is furry and Harry is rough then Harry is kind. Round things are blue.,Harry is not blue.,False,OWA,train,5,AttNeg-OWA-D5-659,5,7,8,3,4,inv-proof,[(((((((triple7) -> rule5)) -> rule2)) -> rule8))]
352189,52166,7,3620,Dave is cold. Dave is quiet. Erin is not big. Erin is cold. Fiona is big. Fiona is not rough. Harry is cold. If Dave is rough and Dave is cold then Dave is young. If something is young and not big then it is blue. If something is big and not quiet then it is blue. If Dave is quiet and Dave is not big then Dave is rough. If something is young and not quiet then it is rough. If something is blue and not cold then it is rough. If something is blue then it is kind. If something is cold then it is young.,Erin is not kind.,False,OWA,train,3,AttNeg-OWA-D3-493,3,7,8,3,5,inv-proof,[(((((((triple4) -> rule8) triple3) -> rule2)) -> rule7))]
395885,6128,7,421,The bear is blue. The bear needs the squirrel. The bear sees the lion. The cow needs the lion. The lion likes the bear. The lion sees the bear. The squirrel likes the cow. If someone sees the lion then the lion likes the squirrel. If the bear is young and the bear does not need the squirrel then the bear sees the cow. If someone likes the squirrel then the squirrel sees the bear. If someone likes the bear and the bear is nice then the bear does not see the squirrel. If someone needs the squirrel then the squirrel sees the cow. If someone sees the cow and they see the bear then the cow sees the bear. If the squirrel likes the cow then the squirrel needs the bear. If someone likes the squirrel and the squirrel needs the bear then the bear is not red.,The cow does not see the bear.,False,OWA,dev,3,RelNeg-OWA-D3-322,3,7,8,3,6,inv-proof,[(((((triple2) -> rule5) ((((triple3) -> rule1)) -> rule3)) -> rule6))]
471173,1304,7,59,"Anne is nice. Anne is young. Charlie is green. Charlie is nice. Erin is green. Erin is nice. Harry is white. Furry people are red. If someone is white then they are nice. If someone is red then they are green. If someone is young then they are furry. White, nice people are young. Furry people are round. All green, nice people are white. Green, young people are white.",Charlie is not furry.,False,OWA,test,5,AttNoneg-OWA-D5-1295,5,7,8,3,6,inv-proof,[(((((((triple3 triple4) -> rule7) triple4) -> rule5)) -> rule4))]
371201,1790,7,122,"Bob is cold. Bob is furry. Bob is nice. Bob is red. Bob is round. Bob is smart. Erin is red. If someone is furry then they are round. If Bob is nice and Bob is big then Bob is smart. All red people are furry. If someone is furry and big then they are round. If someone is red and round then they are nice. All big, cold people are red. All furry people are red. All big people are cold.",Erin is not nice.,False,OWA,test,3,AttNoneg-OWA-D3-1522,3,7,8,3,5,inv-proof,[(((triple7 ((((triple7) -> rule3)) -> rule1)) -> rule5))]
338227,38204,7,2653,"Bob is green. Bob is quiet. Bob is white. Fiona is green. Gary is kind. Gary is quiet. Harry is kind. All red people are green. Red people are quiet. All big, rough people are green. Green people are red. If Gary is quiet and Gary is green then Gary is big. If Gary is quiet and Gary is big then Gary is rough. If someone is quiet then they are red. Big, green people are kind.",Gary is not big.,False,OWA,train,3,AttNoneg-OWA-D3-675,4,7,8,3,5,inv-proof,[(((triple6 ((((triple6) -> rule7)) -> rule1)) -> rule5))]
370335,924,7,62,"Anne is cold. Anne is young. Gary is cold. Gary is green. Gary is young. Harry is green. Harry is white. If something is young then it is nice. If something is nice and green then it is white. If Harry is green and Harry is young then Harry is cold. If something is cold then it is smart. Rough things are green. If Harry is rough then Harry is white. All cold, smart things are white. Nice, cold things are rough.",Anne is not green.,False,OWA,test,3,AttNoneg-OWA-D3-1119,3,7,8,3,5,inv-proof,[(((((((triple2) -> rule1) triple1) -> rule8)) -> rule5))]
300607,584,7,40,"Charlie is quiet. Dave is cold. Dave is furry. Dave is quiet. Dave is rough. Erin is white. Gary is furry. Furry people are quiet. Quiet, cold people are furry. If someone is rough then they are big. If someone is quiet then they are cold. If someone is furry and white then they are rough. All rough, big people are quiet. All white people are rough. Blue people are cold.",Erin is not quiet.,False,OWA,train,3,AttNoneg-OWA-D3-1397,5,7,8,3,6,inv-proof,[(((((triple6) -> rule7) ((((triple6) -> rule7)) -> rule3)) -> rule6))]
392501,2744,7,189,The cow eats the lion. The cow is round. The cow visits the tiger. The lion eats the cow. The lion is nice. The squirrel is cold. The tiger is green. If something sees the cow then the cow sees the lion. If something eats the cow then the cow is green. If the lion sees the squirrel then the lion is green. If something visits the cow then it is nice. If the cow visits the squirrel and the cow sees the squirrel then the cow sees the lion. If something sees the cow then the cow is round. If the cow is cold then the cow sees the lion. If something is green then it is cold.,The cow does not see the lion.,False,OWA,dev,3,RelNoneg-OWA-D3-1512,3,7,8,3,4,inv-proof,[(((((((triple4) -> rule2)) -> rule8)) -> rule7))]
408115,8056,7,384,"Charlie is nice. Dave is cold. Dave is not red. Dave is not rough. Dave is not smart. Gary is blue. Harry is big. Rough things are smart. Red, nice things are smart. All big things are rough. All nice, red things are rough. If Harry is smart and Harry is big then Harry is blue. If Charlie is red then Charlie is blue. All blue, smart things are nice. All nice, rough things are not cold.",Harry is not blue.,False,OWA,train,5,AttNeg-OWA-D5-955,5,7,8,3,5,inv-proof,[(((((((triple7) -> rule3)) -> rule1) triple7) -> rule5))]
469569,69510,7,3308,"Anne is furry. Anne is not kind. Charlie is round. Dave is furry. Dave is round. Gary is big. Gary is not cold. If Dave is quiet then Dave is furry. All quiet people are cold. Round people are quiet. Cold people are big. If someone is rough and not cold then they are big. Big people are kind. All quiet, kind people are furry. Big people are rough.",Charlie is not big.,False,OWA,train,5,AttNeg-OWA-D5-260,5,7,8,3,4,inv-proof,[(((((((triple3) -> rule3)) -> rule2)) -> rule4))]
325075,25052,7,1739,Anne is cold. Anne is rough. Charlie is kind. Erin is blue. Erin is cold. Erin is furry. Gary is cold. Furry people are green. All rough people are furry. Green people are furry. If someone is rough then they are young. If Erin is green and Erin is furry then Erin is young. If someone is young then they are kind. If someone is green and furry then they are rough. If Charlie is young then Charlie is rough.,Erin is not kind.,False,OWA,train,3,AttNeg-OWA-D3-834,3,7,8,3,5,inv-proof,[(((((((triple6) -> rule1) triple6) -> rule5)) -> rule6) OR ((((((((triple6) -> rule1) triple6) -> rule7)) -> rule4)) -> rule6))]
381007,11596,7,801,The bald eagle is big. The bald eagle is red. The bald eagle needs the rabbit. The bald eagle visits the rabbit. The mouse visits the rabbit. The rabbit needs the bald eagle. The rabbit needs the mouse. If something likes the bald eagle and it likes the mouse then the mouse likes the bald eagle. If something likes the mouse then the mouse is kind. If something is red then it likes the mouse. If something is rough and red then it visits the rabbit. If the mouse is kind then the mouse likes the rabbit. If something likes the mouse and it likes the rabbit then the rabbit needs the bald eagle. If something likes the bald eagle then it is red. If something visits the mouse and it does not visit the rabbit then the rabbit is kind.,The mouse does not like the rabbit.,False,OWA,test,3,RelNeg-OWA-D3-897,3,7,8,3,4,inv-proof,[(((((((triple2) -> rule3)) -> rule2)) -> rule5))]
344147,44124,7,3064,The cat sees the rabbit. The dog chases the rabbit. The dog is not blue. The dog is rough. The rabbit chases the dog. The rabbit likes the dog. The rabbit does not see the cat. If the rabbit sees the dog and the dog likes the rabbit then the rabbit is rough. If the cat chases the rabbit then the rabbit is rough. If something chases the cat and it sees the cat then the cat chases the rabbit. If the rabbit does not see the cat then the cat chases the rabbit. If something is rough then it likes the cat. If something is big then it sees the rabbit. If the dog chases the cat then the cat is not green. If the dog is blue and the dog is big then the dog is green.,The rabbit does not like the cat.,False,OWA,train,3,RelNeg-OWA-D3-1241,3,7,8,3,4,inv-proof,[(((((((triple7) -> rule4)) -> rule2)) -> rule5))]
378427,9016,7,622,Bob is blue. Bob is quiet. Charlie is quiet. Fiona is not blue. Fiona is green. Fiona is not smart. Gary is green. If someone is kind and not quiet then they are rough. Quiet people are not smart. Quiet people are kind. If Gary is smart and Gary is blue then Gary is rough. If someone is quiet and not smart then they are green. If someone is green then they are big. All blue people are big. If someone is smart then they are not big.,Charlie is not big.,False,OWA,test,3,AttNeg-OWA-D3-1071,3,7,8,3,5,inv-proof,[(((((triple3 ((triple3) -> rule2)) -> rule5)) -> rule6))]
394451,4694,7,325,The bear chases the cow. The cow chases the bear. The cow is red. The cow visits the bear. The dog is big. The dog likes the cow. The dog visits the bear. If something chases the cow then the cow does not visit the dog. If something likes the bear then the bear is not round. If the cow visits the dog and the cow is not big then the cow chases the bear. If something visits the bear then it is round. If something is round then it likes the bear. If something is round then it likes the bear. If something is red and it does not like the bear then it chases the bear. If something chases the bear and it likes the dog then it chases the dog.,The bear is round.,False,OWA,dev,3,RelNeg-OWA-D3-1307,3,7,8,3,4,inv-proof,[(((((((triple4) -> rule4)) -> rule5)) -> rule2) OR ((((((triple4) -> rule4)) -> rule6)) -> rule2) OR ((((((triple7) -> rule4)) -> rule5)) -> rule2) OR ((((((triple7) -> rule4)) -> rule6)) -> rule2))]
308517,8494,7,595,"Bob is furry. Bob is nice. Bob is rough. Erin is blue. Erin is smart. Erin is white. Gary is cold. If something is cold then it is rough. If Bob is not nice then Bob is cold. All blue things are white. If Gary is smart and Gary is not cold then Gary is furry. If something is furry and not cold then it is blue. All rough, furry things are blue. Blue, white things are smart. If Gary is smart then Gary is rough.",Bob is not smart.,False,OWA,train,3,AttNeg-OWA-D3-1643,3,7,8,3,8,inv-proof,[(((((triple3 triple1) -> rule6) ((((triple3 triple1) -> rule6)) -> rule3)) -> rule7))]
328929,28906,7,2008,The cow chases the squirrel. The cow is blue. The cow sees the lion. The lion chases the cow. The lion chases the squirrel. The squirrel is not blue. The squirrel likes the cow. If someone sees the lion and the lion is kind then they are red. If someone chases the lion and they are not blue then they see the squirrel. If someone chases the squirrel then the squirrel sees the lion. If someone is red then they see the cow. If someone sees the cow then they do not like the cow. If the lion sees the squirrel then the lion likes the cow. If someone chases the cow then the cow is red. If the squirrel chases the cow and the squirrel does not like the cow then the cow is young.,The cow likes the cow.,False,OWA,train,3,RelNeg-OWA-D3-45,3,7,8,3,4,inv-proof,[(((((((triple4) -> rule7)) -> rule4)) -> rule5))]
459995,59936,7,2850,"Anne is big. Charlie is white. Dave is big. Dave is red. Fiona is furry. Fiona is quiet. Fiona is white. All cold things are red. All big things are smart. If Anne is quiet then Anne is cold. If something is smart and furry then it is cold. If Fiona is smart then Fiona is big. If something is red then it is quiet. Smart things are furry. All smart, red things are white.",Anne is not cold.,False,OWA,train,5,AttNoneg-OWA-D5-762,5,7,8,3,6,inv-proof,[(((((triple1) -> rule2) ((((triple1) -> rule2)) -> rule7)) -> rule4))]
